that miss flora millar the lady who had caused the disturbance has actually been arrested it appears that she was formerly a danseuse at the allegro and that she has known the bridegroom for some years there are no further particulars and the whole case is in your hands nowso far as it has been set forth in the public press,0
and an exceedingly interesting case it appears to be i would not have missed it for worlds but there is a ring at the bell watson and as the clock makes it a few minutes after four i have no doubt that this will prove to be our noble client do not dream of going watson for i very much prefer having a witness if only as a check to my own memory,0
lord robert st simon announced our pageboy throwing open the door a gentleman entered with a pleasant cultured face highnosed and pale with something perhaps of petulance about the mouth and with the steady wellopened eye of a man whose pleasant lot it had ever been to command and to be obeyed his manner was brisk and yet his general appearance gave an undue impression of age for he had a slight forward stoop and a little bend of the knees as he walked his hair too as he swept off his very curlybrimmed hat was grizzled round the edges and thin upon the top as to his dress it was careful to the verge of foppishness with high collar black frockcoat white waistcoat yellow gloves patentleather shoes and lightcoloured gaiters he advanced slowly into the room turning his head from left to right and swinging in his right hand the cord which held his golden eyeglasses,0
goodday lord st simon said holmes rising and bowing pray take the basketchair this is my friend and colleague dr watson draw up a little to the fire and we will talk this matter over,0
a most painful matter to me as you can most readily imagine mr holmes i have been cut to the quick i understand that you have already managed several delicate cases of this sort sir though i presume that they were hardly from the same class of society,0
no i am descending,0
i beg pardon,0
my last client of the sort was a king,0
oh really i had no idea and which king,0
the king of scandinavia,0
what had he lost his wife,0
you can understand said holmes suavely that i extend to the affairs of my other clients the same secrecy which i promise to you in yours,0
of course very right very right im sure i beg pardon as to my own case i am ready to give you any information which may assist you in forming an opinion,0
thank you i have already learned all that is in the public prints nothing more i presume that i may take it as correctthis article for example as to the disappearance of the bride,0
lord st simon glanced over it yes it is correct as far as it goes,0
but it needs a great deal of supplementing before anyone could offer an opinion i think that i may arrive at my facts most directly by questioning you,0
when did you first meet miss hatty doran,0
in san francisco a year ago,0
you were travelling in the states,0
did you become engaged then,0
but you were on a friendly footing,0
i was amused by her society and she could see that i was amused,0
her father is very rich,0
he is said to be the richest man on the pacific slope,0
and how did he make his money,0
in mining he had nothing a few years ago then he struck gold invested it and came up by leaps and bounds,0
now what is your own impression as to the young ladysyour wifes character,0
the nobleman swung his glasses a little faster and stared down into the fire you see mr holmes said he my wife was twenty before her father became a rich man during that time she ran free in a mining camp and wandered through woods or mountains so that her education has come from nature rather than from the schoolmaster she is what we call in england a tomboy with a strong nature wild and free unfettered by any sort of traditions she is impetuousvolcanic i was about to say she is swift in making up her mind and fearless in carrying out her resolutions on the other hand i would not have given her the name which i have the honour to bearhe gave a little stately coughhad i not thought her to be at bottom a noble woman i believe that she is capable of heroic selfsacrifice and that anything dishonourable would be repugnant to her,0
have you her photograph,0
i brought this with me he opened a locket and showed us the full face of a very lovely woman it was not a photograph but an ivory miniature and the artist had brought out the full effect of the lustrous black hair the large dark eyes and the exquisite mouth holmes gazed long and earnestly at it then he closed the locket and handed it back to lord st simon,0
the young lady came to london then and you renewed your acquaintance,0
yes her father brought her over for this last london season i met her several times became engaged to her and have now married her,0
she brought i understand a considerable dowry,0
a fair dowry not more than is usual in my family,0
and this of course remains to you since the marriage is a fait accompli,0
i really have made no inquiries on the subject,0
very naturally not did you see miss doran on the day before the wedding,0
was she in good spirits,0
never better she kept talking of what we should do in our future lives,0
indeed that is very interesting and on the morning of the wedding,0
she was as bright as possibleat least until after the ceremony,0
and did you observe any change in her then,0
well to tell the truth i saw then the first signs that i had ever seen that her temper was just a little sharp the incident however was too trivial to relate and can have no possible bearing upon the case,0
pray let us have it for all that,0
oh it is childish she dropped her bouquet as we went towards the vestry she was passing the front pew at the time and it fell over into the pew there was a moments delay but the gentleman in the pew handed it up to her again and it did not appear to be the worse for the fall yet when i spoke to her of the matter she answered me abruptly and in the carriage on our way home she seemed absurdly agitated over this trifling cause,0
indeed you say that there was a gentleman in the pew some of the general public were present then,0
oh yes it is impossible to exclude them when the church is open,0
this gentleman was not one of your wifes friends,0
no no i call him a gentleman by courtesy but he was quite a commonlooking person i hardly noticed his appearance but really i think that we are wandering rather far from the point,0
lady st simon then returned from the wedding in a less cheerful frame of mind than she had gone to it what did she do on reentering her fathers house,0
i saw her in conversation with her maid,0
and who is her maid,0
alice is her name she is an american and came from california with her,0
a confidential servant,0
a little too much so it seemed to me that her mistress allowed her to take great liberties still of course in america they look upon these things in a different way,0
how long did she speak to this alice,0
oh a few minutes i had something else to think of,0
you did not overhear what they said,0
lady st simon said something about jumping a claim she was accustomed to use slang of the kind i have no idea what she meant,0
american slang is very expressive sometimes and what did your wife do when she finished speaking to her maid,0
she walked into the breakfastroom,0
on your arm,0
no alone she was very independent in little matters like that then after we had sat down for ten minutes or so she rose hurriedly muttered some words of apology and left the room she never came back,0
but this maid alice as i understand deposes that she went to her room covered her brides dress with a long ulster put on a bonnet and went out,0
quite so and she was afterwards seen walking into hyde park in company with flora millar a woman who is now in custody and who had already made a disturbance at mr dorans house that morning,0
ah yes i should like a few particulars as to this young lady and your relations to her,0
lord st simon shrugged his shoulders and raised his eyebrows we have been on a friendly footing for some yearsi may say on a very friendly footing she used to be at the allegro i have not treated her ungenerously and she had no just cause of complaint against me but you know what women are mr holmes flora was a dear little thing but exceedingly hotheaded and devotedly attached to me she wrote me dreadful letters when she heard that i was about to be married and to tell the truth the reason why i had the marriage celebrated so quietly was that i feared lest there might be a scandal in the church she came to mr dorans door just after we returned and she endeavoured to push her way in uttering very abusive expressions towards my wife and even threatening her but i had foreseen the possibility of something of the sort and i had two police fellows there in private clothes who soon pushed her out again she was quiet when she saw that there was no good in making a row,0
did your wife hear all this,0
no thank goodness she did not,0
and she was seen walking with this very woman afterwards,0
yes that is what mr lestrade of scotland yard looks upon as so serious it is thought that flora decoyed my wife out and laid some terrible trap for her,0
well it is a possible supposition,0
you think so too,0
i did not say a probable one but you do not yourself look upon this as likely,0
i do not think flora would hurt a fly,0
still jealousy is a strange transformer of characters pray what is your own theory as to what took place,0
well really i came to seek a theory not to propound one i have given you all the facts since you ask me however i may say that it has occurred to me as possible that the excitement of this affair the consciousness that she had made so immense a social stride had the effect of causing some little nervous disturbance in my wife,0
in short that she had become suddenly deranged,0
well really when i consider that she has turned her backi will not say upon me but upon so much that many have aspired to without successi can hardly explain it in any other fashion,0
well certainly that is also a conceivable hypothesis said holmes smiling and now lord st simon i think that i have nearly all my data may i ask whether you were seated at the breakfasttable so that you could see out of the window,0
we could see the other side of the road and the park,0
quite so then i do not think that i need to detain you longer i shall communicate with you,0
should you be fortunate enough to solve this problem said our client rising,0
i have solved it,0
eh what was that,0
i say that i have solved it,0
where then is my wife,0
that is a detail which i shall speedily supply,0
lord st simon shook his head i am afraid that it will take wiser heads than yours or mine he remarked and bowing in a stately oldfashioned manner he departed,0
it is very good of lord st simon to honour my head by putting it on a level with his own said sherlock holmes laughing i think that i shall have a whisky and soda and a cigar after all this crossquestioning i had formed my conclusions as to the case before our client came into the room,0
i have notes of several similar cases though none as i remarked before which were quite as prompt my whole examination served to turn my conjecture into a certainty circumstantial evidence is occasionally very convincing as when you find a trout in the milk to quote thoreaus example,0
but i have heard all that you have heard,0
without however the knowledge of preexisting cases which serves me so well there was a parallel instance in aberdeen some years back and something on very much the same lines at munich the year after the francoprussian war it is one of these casesbut hullo here is lestrade goodafternoon lestrade you will find an extra tumbler upon the sideboard and there are cigars in the box,0
the official detective was attired in a peajacket and cravat which gave him a decidedly nautical appearance and he carried a black canvas bag in his hand with a short greeting he seated himself and lit the cigar which had been offered to him,0
whats up then asked holmes with a twinkle in his eye you look dissatisfied,0
and i feel dissatisfied it is this infernal st simon marriage case i can make neither head nor tail of the business,0
really you surprise me,0
who ever heard of such a mixed affair every clue seems to slip through my fingers i have been at work upon it all day,0
and very wet it seems to have made you said holmes laying his hand upon the arm of the peajacket,0
yes i have been dragging the serpentine,0
in heavens name what for,0
in search of the body of lady st simon,0
sherlock holmes leaned back in his chair and laughed heartily,0
have you dragged the basin of trafalgar square fountain he asked,0
because you have just as good a chance of finding this lady in the one as in the other,0
lestrade shot an angry glance at my companion i suppose you know all about it he snarled,0
well i have only just heard the facts but my mind is made up,0
oh indeed then you think that the serpentine plays no part in the matter,0
i think it very unlikely,0
then perhaps you will kindly explain how it is that we found this in it he opened his bag as he spoke and tumbled onto the floor a weddingdress of watered silk a pair of white satin shoes and a brides wreath and veil all discoloured and soaked in water there said he putting a new weddingring upon the top of the pile there is a little nut for you to crack master holmes,0
oh indeed said my friend blowing blue rings into the air you dragged them from the serpentine,0
no they were found floating near the margin by a parkkeeper they have been identified as her clothes and it seemed to me that if the clothes were there the body would not be far off,0
by the same brilliant reasoning every mans body is to be found in the neighbourhood of his wardrobe and pray what did you hope to arrive at through this,0
at some evidence implicating flora millar in the disappearance,0
i am afraid that you will find it difficult,0
are you indeed now cried lestrade with some bitterness i am afraid holmes that you are not very practical with your deductions and your inferences you have made two blunders in as many minutes this dress does implicate miss flora millar,0
and how,0
in the dress is a pocket in the pocket is a cardcase in the cardcase is a note and here is the very note he slapped it down upon the table in front of him listen to this you will see me when all is ready come at once f h m now my theory all along has been that lady st simon was decoyed away by flora millar and that she with confederates no doubt was responsible for her disappearance here signed with her initials is the very note which was no doubt quietly slipped into her hand at the door and which lured her within their reach,0
very good lestrade said holmes laughing you really are very fine indeed let me see it he took up the paper in a listless way but his attention instantly became riveted and he gave a little cry of satisfaction this is indeed important said he,0
ha you find it so,0
extremely so i congratulate you warmly,0
lestrade rose in his triumph and bent his head to look why he shrieked youre looking at the wrong side,0
on the contrary this is the right side,0
the right side youre mad here is the note written in pencil over here,0
and over here is what appears to be the fragment of a hotel bill which interests me deeply,0
theres nothing in it i looked at it before said lestrade oct 4th rooms 8s breakfast 2s 6d cocktail 1s lunch 2s 6d glass sherry 8d i see nothing in that,0
very likely not it is most important all the same as to the note it is important also or at least the initials are so i congratulate you again,0
ive wasted time enough said lestrade rising i believe in hard work and not in sitting by the fire spinning fine theories goodday mr holmes and we shall see which gets to the bottom of the matter first he gathered up the garments thrust them into the bag and made for the door,0
just one hint to you lestrade drawled holmes before his rival vanished i will tell you the true solution of the matter lady st simon is a myth there is not and there never has been any such person,0
lestrade looked sadly at my companion then he turned to me tapped his forehead three times shook his head solemnly and hurried away,0
he had hardly shut the door behind him when holmes rose to put on his overcoat there is something in what the fellow says about outdoor work he remarked so i think watson that i must leave you to your papers for a little,0
it was after five oclock when sherlock holmes left me but i had no time to be lonely for within an hour there arrived a confectioners man with a very large flat box this he unpacked with the help of a youth whom he had brought with him and presently to my very great astonishment a quite epicurean little cold supper began to be laid out upon our humble lodginghouse mahogany there were a couple of brace of cold woodcock a pheasant a pt de foie gras pie with a group of ancient and cobwebby bottles having laid out all these luxuries my two visitors vanished away like the genii of the arabian nights with no explanation save that the things had been paid for and were ordered to this address,0
just before nine oclock sherlock holmes stepped briskly into the room his features were gravely set but there was a light in his eye which made me think that he had not been disappointed in his conclusions,0
they have laid the supper then he said rubbing his hands,0
you seem to expect company they have laid for five,0
yes i fancy we may have some company dropping in said he i am surprised that lord st simon has not already arrived ha i fancy that i hear his step now upon the stairs,0
it was indeed our visitor of the afternoon who came bustling in dangling his glasses more vigorously than ever and with a very perturbed expression upon his aristocratic features,0
my messenger reached you then asked holmes,0
yes and i confess that the contents startled me beyond measure have you good authority for what you say,0
the best possible,0
lord st simon sank into a chair and passed his hand over his forehead,0
what will the duke say he murmured when he hears that one of the family has been subjected to such humiliation,0
it is the purest accident i cannot allow that there is any humiliation,0
ah you look on these things from another standpoint,0
i fail to see that anyone is to blame i can hardly see how the lady could have acted otherwise though her abrupt method of doing it was undoubtedly to be regretted having no mother she had no one to advise her at such a crisis,0
it was a slight sir a public slight said lord st simon tapping his fingers upon the table,0
you must make allowance for this poor girl placed in so unprecedented a position,0
i will make no allowance i am very angry indeed and i have been shamefully used,0
i think that i heard a ring said holmes yes there are steps on the landing if i cannot persuade you to take a lenient view of the matter lord st simon i have brought an advocate here who may be more successful he opened the door and ushered in a lady and gentleman lord st simon said he allow me to introduce you to mr and mrs francis hay moulton the lady i think you have already met,0
at the sight of these newcomers our client had sprung from his seat and stood very erect with his eyes cast down and his hand thrust into the breast of his frockcoat a picture of offended dignity the lady had taken a quick step forward and had held out her hand to him but he still refused to raise his eyes it was as well for his resolution perhaps for her pleading face was one which it was hard to resist,0
youre angry robert said she well i guess you have every cause to be,0
pray make no apology to me said lord st simon bitterly,0
oh yes i know that i have treated you real bad and that i should have spoken to you before i went but i was kind of rattled and from the time when i saw frank here again i just didnt know what i was doing or saying i only wonder i didnt fall down and do a faint right there before the altar,0
perhaps mrs moulton you would like my friend and me to leave the room while you explain this matter,0
if i may give an opinion remarked the strange gentleman weve had just a little too much secrecy over this business already for my part i should like all europe and america to hear the rights of it he was a small wiry sunburnt man cleanshaven with a sharp face and alert manner,0
then ill tell our story right away said the lady frank here and i met in 84 in mcquires camp near the rockies where pa was working a claim we were engaged to each other frank and i but then one day father struck a rich pocket and made a pile while poor frank here had a claim that petered out and came to nothing the richer pa grew the poorer was frank so at last pa wouldnt hear of our engagement lasting any longer and he took me away to frisco frank wouldnt throw up his hand though so he followed me there and he saw me without pa knowing anything about it it would only have made him mad to know so we just fixed it all up for ourselves frank said that he would go and make his pile too and never come back to claim me until he had as much as pa so then i promised to wait for him to the end of time and pledged myself not to marry anyone else while he lived why shouldnt we be married right away then said he and then i will feel sure of you and i wont claim to be your husband until i come back well we talked it over and he had fixed it all up so nicely with a clergyman all ready in waiting that we just did it right there and then frank went off to seek his fortune and i went back to pa,0
the next i heard of frank was that he was in montana and then he went prospecting in arizona and then i heard of him from new mexico after that came a long newspaper story about how a miners camp had been attacked by apache indians and there was my franks name among the killed i fainted dead away and i was very sick for months after pa thought i had a decline and took me to half the doctors in frisco not a word of news came for a year and more so that i never doubted that frank was really dead then lord st simon came to frisco and we came to london and a marriage was arranged and pa was very pleased but i felt all the time that no man on this earth would ever take the place in my heart that had been given to my poor frank,0
still if i had married lord st simon of course id have done my duty by him we cant command our love but we can our actions i went to the altar with him with the intention to make him just as good a wife as it was in me to be but you may imagine what i felt when just as i came to the altar rails i glanced back and saw frank standing and looking at me out of the first pew i thought it was his ghost at first but when i looked again there he was still with a kind of question in his eyes as if to ask me whether i were glad or sorry to see him i wonder i didnt drop i know that everything was turning round and the words of the clergyman were just like the buzz of a bee in my ear i didnt know what to do should i stop the service and make a scene in the church i glanced at him again and he seemed to know what i was thinking for he raised his finger to his lips to tell me to be still then i saw him scribble on a piece of paper and i knew that he was writing me a note as i passed his pew on the way out i dropped my bouquet over to him and he slipped the note into my hand when he returned me the flowers it was only a line asking me to join him when he made the sign to me to do so of course i never doubted for a moment that my first duty was now to him and i determined to do just whatever he might direct,0
when i got back i told my maid who had known him in california and had always been his friend i ordered her to say nothing but to get a few things packed and my ulster ready i know i ought to have spoken to lord st simon but it was dreadful hard before his mother and all those great people i just made up my mind to run away and explain afterwards i hadnt been at the table ten minutes before i saw frank out of the window at the other side of the road he beckoned to me and then began walking into the park i slipped out put on my things and followed him some woman came talking something or other about lord st simon to meseemed to me from the little i heard as if he had a little secret of his own before marriage alsobut i managed to get away from her and soon overtook frank we got into a cab together and away we drove to some lodgings he had taken in gordon square and that was my true wedding after all those years of waiting frank had been a prisoner among the apaches had escaped came on to frisco found that i had given him up for dead and had gone to england followed me there and had come upon me at last on the very morning of my second wedding,0
i saw it in a paper explained the american it gave the name and the church but not where the lady lived,0
