the project gutenberg ebook of the adventures of sherlock holmes,0
by sir arthur conan doyle,0
15 in our series by sir arthur conan doyle,0
 used as training data for the spelling corrector,0
copyright laws are changing all over the world be sure to check the,0
copyright laws for your country before downloading or redistributing,0
this or any other project gutenberg ebook,0
this header should be the first thing seen when viewing this project,0
gutenberg file please do not remove it do not change or edit the,0
header without written permission,0
please read the legal small print and other information about the,0
ebook and project gutenberg at the bottom of this file included is,0
important information about your specific rights and restrictions in,0
how the file may be used you can also find out about how to make a,0
donation to project gutenberg and how to get involved,0
welcome to the world of free plain vanilla electronic texts,0
ebooks readable by both humans and by computers since 1971,0
these ebooks were prepared by thousands of volunteers,0
title the adventures of sherlock holmes,0
author sir arthur conan doyle,0
release date march 1999 ebook 1661,0
most recently updated november 29 2002,0
edition 12,0
language english,0
character set encoding ascii,0
 start of the project gutenberg ebook the adventures of sherlock holmes ,0
additional editing by jose menendez,0
the adventures of,0
sherlock holmes,0
by,0
sir arthur conan doyle,0
contents,0
ia scandal in bohemia,0
iithe redheaded league,0
iiia case of identity,0
ivthe boscombe valley mystery,0
vthe five orange pips,0
vithe man with the twisted lip,0
viithe adventure of the blue carbuncle,0
viiithe adventure of the speckled band,0
ixthe adventure of the engineers thumb,0
xthe adventure of the noble bachelor,0
xithe adventure of the beryl coronet,0
xiithe adventure of the copper beeches,0
adventure i a scandal in bohemia,0
i,0
to sherlock holmes she is always the woman i have seldom heard him mention her under any other name in his eyes she eclipses and predominates the whole of her sex it was not that he felt any emotion akin to love for irene adler all emotions and that one particularly were abhorrent to his cold precise but admirably balanced mind he was i take it the most perfect reasoning and observing machine that the world has seen but as a lover he would have placed himself in a false position he never spoke of the softer passions save with a gibe and a sneer they were admirable things for the observerexcellent for drawing the veil from mens motives and actions but for the trained reasoner to admit such intrusions into his own delicate and finely adjusted temperament was to introduce a distracting factor which might throw a doubt upon all his mental results grit in a sensitive instrument or a crack in one of his own highpower lenses would not be more disturbing than a strong emotion in a nature such as his and yet there was but one woman to him and that woman was the late irene adler of dubious and questionable memory,0
i had seen little of holmes lately my marriage had drifted us away from each other my own complete happiness and the homecentred interests which rise up around the man who first finds himself master of his own establishment were sufficient to absorb all my attention while holmes who loathed every form of society with his whole bohemian soul remained in our lodgings in baker street buried among his old books and alternating from week to week between cocaine and ambition the drowsiness of the drug and the fierce energy of his own keen nature he was still as ever deeply attracted by the study of crime and occupied his immense faculties and extraordinary powers of observation in following out those clues and clearing up those mysteries which had been abandoned as hopeless by the official police from time to time i heard some vague account of his doings of his summons to odessa in the case of the trepoff murder of his clearing up of the singular tragedy of the atkinson brothers at trincomalee and finally of the mission which he had accomplished so delicately and successfully for the reigning family of holland beyond these signs of his activity however which i merely shared with all the readers of the daily press i knew little of my former friend and companion,0
one nightit was on the twentieth of march 1888i was returning from a journey to a patient for i had now returned to civil practice when my way led me through baker street as i passed the wellremembered door which must always be associated in my mind with my wooing and with the dark incidents of the study in scarlet i was seized with a keen desire to see holmes again and to know how he was employing his extraordinary powers his rooms were brilliantly lit and even as i looked up i saw his tall spare figure pass twice in a dark silhouette against the blind he was pacing the room swiftly eagerly with his head sunk upon his chest and his hands clasped behind him to me who knew his every mood and habit his attitude and manner told their own story he was at work again he had risen out of his drugcreated dreams and was hot upon the scent of some new problem i rang the bell and was shown up to the chamber which had formerly been in part my own,0
his manner was not effusive it seldom was but he was glad i think to see me with hardly a word spoken but with a kindly eye he waved me to an armchair threw across his case of cigars and indicated a spirit case and a gasogene in the corner then he stood before the fire and looked me over in his singular introspective fashion,0
wedlock suits you he remarked i think watson that you have put on seven and a half pounds since i saw you,0
seven i answered,0
indeed i should have thought a little more just a trifle more i fancy watson and in practice again i observe you did not tell me that you intended to go into harness,0
then how do you know,0
i see it i deduce it how do i know that you have been getting yourself very wet lately and that you have a most clumsy and careless servant girl,0
my dear holmes said i this is too much you would certainly have been burned had you lived a few centuries ago it is true that i had a country walk on thursday and came home in a dreadful mess but as i have changed my clothes i cant imagine how you deduce it as to mary jane she is incorrigible and my wife has given her notice but there again i fail to see how you work it out,0
he chuckled to himself and rubbed his long nervous hands together,0
it is simplicity itself said he my eyes tell me that on the inside of your left shoe just where the firelight strikes it the leather is scored by six almost parallel cuts obviously they have been caused by someone who has very carelessly scraped round the edges of the sole in order to remove crusted mud from it hence you see my double deduction that you had been out in vile weather and that you had a particularly malignant bootslitting specimen of the london slavey as to your practice if a gentleman walks into my rooms smelling of iodoform with a black mark of nitrate of silver upon his right forefinger and a bulge on the right side of his tophat to show where he has secreted his stethoscope i must be dull indeed if i do not pronounce him to be an active member of the medical profession,0
i could not help laughing at the ease with which he explained his process of deduction when i hear you give your reasons i remarked the thing always appears to me to be so ridiculously simple that i could easily do it myself though at each successive instance of your reasoning i am baffled until you explain your process and yet i believe that my eyes are as good as yours,0
quite so he answered lighting a cigarette and throwing himself down into an armchair you see but you do not observe the distinction is clear for example you have frequently seen the steps which lead up from the hall to this room,0
frequently,0
how often,0
well some hundreds of times,0
then how many are there,0
how many i dont know,0
quite so you have not observed and yet you have seen that is just my point now i know that there are seventeen steps because i have both seen and observed by the way since you are interested in these little problems and since you are good enough to chronicle one or two of my trifling experiences you may be interested in this he threw over a sheet of thick pinktinted notepaper which had been lying open upon the table it came by the last post said he read it aloud,0
the note was undated and without either signature or address,0
there will call upon you tonight at a quarter to eight oclock it said a gentleman who desires to consult you upon a matter of the very deepest moment your recent services to one of the royal houses of europe have shown that you are one who may safely be trusted with matters which are of an importance which can hardly be exaggerated this account of you we have from all quarters received be in your chamber then at that hour and do not take it amiss if your visitor wear a mask,0
this is indeed a mystery i remarked what do you imagine that it means,0
i have no data yet it is a capital mistake to theorise before one has data insensibly one begins to twist facts to suit theories instead of theories to suit facts but the note itself what do you deduce from it,0
i carefully examined the writing and the paper upon which it was written,0
the man who wrote it was presumably well to do i remarked endeavouring to imitate my companions processes such paper could not be bought under half a crown a packet it is peculiarly strong and stiff,0
peculiarthat is the very word said holmes it is not an english paper at all hold it up to the light,0
i did so and saw a large e with a small g a p and a large g with a small t woven into the texture of the paper,0
what do you make of that asked holmes,0
the name of the maker no doubt or his monogram rather,0
not at all the g with the small t stands for gesellschaft which is the german for company it is a customary contraction like our co p of course stands for papier now for the eg let us glance at our continental gazetteer he took down a heavy brown volume from his shelves eglow eglonitzhere we are egria it is in a germanspeaking countryin bohemia not far from carlsbad remarkable as being the scene of the death of wallenstein and for its numerous glassfactories and papermills ha ha my boy what do you make of that his eyes sparkled and he sent up a great blue triumphant cloud from his cigarette,0
the paper was made in bohemia i said,0
precisely and the man who wrote the note is a german do you note the peculiar construction of the sentencethis account of you we have from all quarters received a frenchman or russian could not have written that it is the german who is so uncourteous to his verbs it only remains therefore to discover what is wanted by this german who writes upon bohemian paper and prefers wearing a mask to showing his face and here he comes if i am not mistaken to resolve all our doubts,0
as he spoke there was the sharp sound of horses hoofs and grating wheels against the curb followed by a sharp pull at the bell holmes whistled,0
a pair by the sound said he yes he continued glancing out of the window a nice little brougham and a pair of beauties a hundred and fifty guineas apiece theres money in this case watson if there is nothing else,0
i think that i had better go holmes,0
not a bit doctor stay where you are i am lost without my boswell and this promises to be interesting it would be a pity to miss it,0
but your client,0
never mind him i may want your help and so may he here he comes sit down in that armchair doctor and give us your best attention,0
a slow and heavy step which had been heard upon the stairs and in the passage paused immediately outside the door then there was a loud and authoritative tap,0
come in said holmes,0
a man entered who could hardly have been less than six feet six inches in height with the chest and limbs of a hercules his dress was rich with a richness which would in england be looked upon as akin to bad taste heavy bands of astrakhan were slashed across the sleeves and fronts of his doublebreasted coat while the deep blue cloak which was thrown over his shoulders was lined with flamecoloured silk and secured at the neck with a brooch which consisted of a single flaming beryl boots which extended halfway up his calves and which were trimmed at the tops with rich brown fur completed the impression of barbaric opulence which was suggested by his whole appearance he carried a broadbrimmed hat in his hand while he wore across the upper part of his face extending down past the cheekbones a black vizard mask which he had apparently adjusted that very moment for his hand was still raised to it as he entered from the lower part of the face he appeared to be a man of strong character with a thick hanging lip and a long straight chin suggestive of resolution pushed to the length of obstinacy,0
you had my note he asked with a deep harsh voice and a strongly marked german accent i told you that i would call he looked from one to the other of us as if uncertain which to address,0
pray take a seat said holmes this is my friend and colleague dr watson who is occasionally good enough to help me in my cases whom have i the honour to address,0
you may address me as the count von kramm a bohemian nobleman i understand that this gentleman your friend is a man of honour and discretion whom i may trust with a matter of the most extreme importance if not i should much prefer to communicate with you alone,0
i rose to go but holmes caught me by the wrist and pushed me back into my chair it is both or none said he you may say before this gentleman anything which you may say to me,0
the count shrugged his broad shoulders then i must begin said he by binding you both to absolute secrecy for two years at the end of that time the matter will be of no importance at present it is not too much to say that it is of such weight it may have an influence upon european history,0
i promise said holmes,0
and i,0
you will excuse this mask continued our strange visitor the august person who employs me wishes his agent to be unknown to you and i may confess at once that the title by which i have just called myself is not exactly my own,0
i was aware of it said holmes dryly,0
the circumstances are of great delicacy and every precaution has to be taken to quench what might grow to be an immense scandal and seriously compromise one of the reigning families of europe to speak plainly the matter implicates the great house of ormstein hereditary kings of bohemia,0
i was also aware of that murmured holmes settling himself down in his armchair and closing his eyes,0
our visitor glanced with some apparent surprise at the languid lounging figure of the man who had been no doubt depicted to him as the most incisive reasoner and most energetic agent in europe holmes slowly reopened his eyes and looked impatiently at his gigantic client,0
if your majesty would condescend to state your case he remarked i should be better able to advise you,0
the man sprang from his chair and paced up and down the room in uncontrollable agitation then with a gesture of desperation he tore the mask from his face and hurled it upon the ground you are right he cried i am the king why should i attempt to conceal it,0
why indeed murmured holmes your majesty had not spoken before i was aware that i was addressing wilhelm gottsreich sigismond von ormstein grand duke of casselfelstein and hereditary king of bohemia,0
but you can understand said our strange visitor sitting down once more and passing his hand over his high white forehead you can understand that i am not accustomed to doing such business in my own person yet the matter was so delicate that i could not confide it to an agent without putting myself in his power i have come incognito from prague for the purpose of consulting you,0
then pray consult said holmes shutting his eyes once more,0
the facts are briefly these some five years ago during a lengthy visit to warsaw i made the acquaintance of the wellknown adventuress irene adler the name is no doubt familiar to you,0
kindly look her up in my index doctor murmured holmes without opening his eyes for many years he had adopted a system of docketing all paragraphs concerning men and things so that it was difficult to name a subject or a person on which he could not at once furnish information in this case i found her biography sandwiched in between that of a hebrew rabbi and that of a staffcommander who had written a monograph upon the deepsea fishes,0
let me see said holmes hum born in new jersey in the year 1858 contraltohum la scala hum prima donna imperial opera of warsawyes retired from operatic stageha living in londonquite so your majesty as i understand became entangled with this young person wrote her some compromising letters and is now desirous of getting those letters back,0
precisely so but how,0
was there a secret marriage,0
none,0
no legal papers or certificates,0
then i fail to follow your majesty if this young person should produce her letters for blackmailing or other purposes how is she to prove their authenticity,0
there is the writing,0
pooh pooh forgery,0
my private notepaper,0
stolen,0
my own seal,0
imitated,0
my photograph,0
bought,0
we were both in the photograph,0
oh dear that is very bad your majesty has indeed committed an indiscretion,0
i was madinsane,0
you have compromised yourself seriously,0
i was only crown prince then i was young i am but thirty now,0
it must be recovered,0
we have tried and failed,0
your majesty must pay it must be bought,0
she will not sell,0
stolen then,0
five attempts have been made twice burglars in my pay ransacked her house once we diverted her luggage when she travelled twice she has been waylaid there has been no result,0
no sign of it,0
absolutely none,0
holmes laughed it is quite a pretty little problem said he,0
but a very serious one to me returned the king reproachfully,0
very indeed and what does she propose to do with the photograph,0
to ruin me,0
but how,0
i am about to be married,0
so i have heard,0
to clotilde lothman von saxemeningen second daughter of the king of scandinavia you may know the strict principles of her family she is herself the very soul of delicacy a shadow of a doubt as to my conduct would bring the matter to an end,0
and irene adler,0
threatens to send them the photograph and she will do it i know that she will do it you do not know her but she has a soul of steel she has the face of the most beautiful of women and the mind of the most resolute of men rather than i should marry another woman there are no lengths to which she would not gonone,0
you are sure that she has not sent it yet,0
i am sure,0
and why,0
because she has said that she would send it on the day when the betrothal was publicly proclaimed that will be next monday,0
oh then we have three days yet said holmes with a yawn that is very fortunate as i have one or two matters of importance to look into just at present your majesty will of course stay in london for the present,0
certainly you will find me at the langham under the name of the count von kramm,0
then i shall drop you a line to let you know how we progress,0
pray do so i shall be all anxiety,0
then as to money,0
you have carte blanche,0
absolutely,0
i tell you that i would give one of the provinces of my kingdom to have that photograph,0
and for present expenses,0
the king took a heavy chamois leather bag from under his cloak and laid it on the table,0
there are three hundred pounds in gold and seven hundred in notes he said,0
holmes scribbled a receipt upon a sheet of his notebook and handed it to him,0
and mademoiselles address he asked,0
is briony lodge serpentine avenue st johns wood,0
holmes took a note of it one other question said he was the photograph a cabinet,0
it was,0
then goodnight your majesty and i trust that we shall soon have some good news for you and goodnight watson he added as the wheels of the royal brougham rolled down the street if you will be good enough to call tomorrow afternoon at three oclock i should like to chat this little matter over with you,0
ii,0
at three oclock precisely i was at baker street but holmes had not yet returned the landlady informed me that he had left the house shortly after eight oclock in the morning i sat down beside the fire however with the intention of awaiting him however long he might be i was already deeply interested in his inquiry for though it was surrounded by none of the grim and strange features which were associated with the two crimes which i have already recorded still the nature of the case and the exalted station of his client gave it a character of its own indeed apart from the nature of the investigation which my friend had on hand there was something in his masterly grasp of a situation and his keen incisive reasoning which made it a pleasure to me to study his system of work and to follow the quick subtle methods by which he disentangled the most inextricable mysteries so accustomed was i to his invariable success that the very possibility of his failing had ceased to enter into my head,0
it was close upon four before the door opened and a drunkenlooking groom illkempt and sidewhiskered with an inflamed face and disreputable clothes walked into the room accustomed as i was to my friends amazing powers in the use of disguises i had to look three times before i was certain that it was indeed he with a nod he vanished into the bedroom whence he emerged in five minutes tweedsuited and respectable as of old putting his hands into his pockets he stretched out his legs in front of the fire and laughed heartily for some minutes,0
well really he cried and then he choked and laughed again until he was obliged to lie back limp and helpless in the chair,0
what is it,0
its quite too funny i am sure you could never guess how i employed my morning or what i ended by doing,0
i cant imagine i suppose that you have been watching the habits and perhaps the house of miss irene adler,0
quite so but the sequel was rather unusual i will tell you however i left the house a little after eight oclock this morning in the character of a groom out of work there is a wonderful sympathy and freemasonry among horsey men be one of them and you will know all that there is to know i soon found briony lodge it is a bijou villa with a garden at the back but built out in front right up to the road two stories chubb lock to the door large sittingroom on the right side well furnished with long windows almost to the floor and those preposterous english window fasteners which a child could open behind there was nothing remarkable save that the passage window could be reached from the top of the coachhouse i walked round it and examined it closely from every point of view but without noting anything else of interest,0
i then lounged down the street and found as i expected that there was a mews in a lane which runs down by one wall of the garden i lent the ostlers a hand in rubbing down their horses and received in exchange twopence a glass of halfandhalf two fills of shag tobacco and as much information as i could desire about miss adler to say nothing of half a dozen other people in the neighbourhood in whom i was not in the least interested but whose biographies i was compelled to listen to,0
and what of irene adler i asked,0
oh she has turned all the mens heads down in that part she is the daintiest thing under a bonnet on this planet so say the serpentinemews to a man she lives quietly sings at concerts drives out at five every day and returns at seven sharp for dinner seldom goes out at other times except when she sings has only one male visitor but a good deal of him he is dark handsome and dashing never calls less than once a day and often twice he is a mr godfrey norton of the inner temple see the advantages of a cabman as a confidant they had driven him home a dozen times from serpentinemews and knew all about him when i had listened to all they had to tell i began to walk up and down near briony lodge once more and to think over my plan of campaign,0
this godfrey norton was evidently an important factor in the matter he was a lawyer that sounded ominous what was the relation between them and what the object of his repeated visits was she his client his friend or his mistress if the former she had probably transferred the photograph to his keeping if the latter it was less likely on the issue of this question depended whether i should continue my work at briony lodge or turn my attention to the gentlemans chambers in the temple it was a delicate point and it widened the field of my inquiry i fear that i bore you with these details but i have to let you see my little difficulties if you are to understand the situation,0
i am following you closely i answered,0
i was still balancing the matter in my mind when a hansom cab drove up to briony lodge and a gentleman sprang out he was a remarkably handsome man dark aquiline and moustachedevidently the man of whom i had heard he appeared to be in a great hurry shouted to the cabman to wait and brushed past the maid who opened the door with the air of a man who was thoroughly at home,0
he was in the house about half an hour and i could catch glimpses of him in the windows of the sittingroom pacing up and down talking excitedly and waving his arms of her i could see nothing presently he emerged looking even more flurried than before as he stepped up to the cab he pulled a gold watch from his pocket and looked at it earnestly drive like the devil he shouted first to gross hankeys in regent street and then to the church of st monica in the edgeware road half a guinea if you do it in twenty minutes,0
