well of course it was obvious from the first that this mr hosmer angel must have some strong object for his curious conduct and it was equally clear that the only man who really profited by the incident as far as we could see was the stepfather then the fact that the two men were never together but that the one always appeared when the other was away was suggestive so were the tinted spectacles and the curious voice which both hinted at a disguise as did the bushy whiskers my suspicions were all confirmed by his peculiar action in typewriting his signature which of course inferred that his handwriting was so familiar to her that she would recognise even the smallest sample of it you see all these isolated facts together with many minor ones all pointed in the same direction,0
and how did you verify them,0
having once spotted my man it was easy to get corroboration i knew the firm for which this man worked having taken the printed description i eliminated everything from it which could be the result of a disguisethe whiskers the glasses the voice and i sent it to the firm with a request that they would inform me whether it answered to the description of any of their travellers i had already noticed the peculiarities of the typewriter and i wrote to the man himself at his business address asking him if he would come here as i expected his reply was typewritten and revealed the same trivial but characteristic defects the same post brought me a letter from westhouse marbank of fenchurch street to say that the description tallied in every respect with that of their employ james windibank voil tout,0
and miss sutherland,0
if i tell her she will not believe me you may remember the old persian saying there is danger for him who taketh the tiger cub and danger also for whoso snatches a delusion from a woman there is as much sense in hafiz as in horace and as much knowledge of the world,0
adventure iv the boscombe valley mystery,0
we were seated at breakfast one morning my wife and i when the maid brought in a telegram it was from sherlock holmes and ran in this way,0
have you a couple of days to spare have just been wired for from the west of england in connection with boscombe valley tragedy shall be glad if you will come with me air and scenery perfect leave paddington by the 1115,0
what do you say dear said my wife looking across at me will you go,0
i really dont know what to say i have a fairly long list at present,0
oh anstruther would do your work for you you have been looking a little pale lately i think that the change would do you good and you are always so interested in mr sherlock holmes cases,0
i should be ungrateful if i were not seeing what i gained through one of them i answered but if i am to go i must pack at once for i have only half an hour,0
my experience of camp life in afghanistan had at least had the effect of making me a prompt and ready traveller my wants were few and simple so that in less than the time stated i was in a cab with my valise rattling away to paddington station sherlock holmes was pacing up and down the platform his tall gaunt figure made even gaunter and taller by his long grey travellingcloak and closefitting cloth cap,0
it is really very good of you to come watson said he it makes a considerable difference to me having someone with me on whom i can thoroughly rely local aid is always either worthless or else biassed if you will keep the two corner seats i shall get the tickets,0
we had the carriage to ourselves save for an immense litter of papers which holmes had brought with him among these he rummaged and read with intervals of notetaking and of meditation until we were past reading then he suddenly rolled them all into a gigantic ball and tossed them up onto the rack,0
have you heard anything of the case he asked,0
not a word i have not seen a paper for some days,0
the london press has not had very full accounts i have just been looking through all the recent papers in order to master the particulars it seems from what i gather to be one of those simple cases which are so extremely difficult,0
that sounds a little paradoxical,0
but it is profoundly true singularity is almost invariably a clue the more featureless and commonplace a crime is the more difficult it is to bring it home in this case however they have established a very serious case against the son of the murdered man,0
it is a murder then,0
well it is conjectured to be so i shall take nothing for granted until i have the opportunity of looking personally into it i will explain the state of things to you as far as i have been able to understand it in a very few words,0
boscombe valley is a country district not very far from ross in herefordshire the largest landed proprietor in that part is a mr john turner who made his money in australia and returned some years ago to the old country one of the farms which he held that of hatherley was let to mr charles mccarthy who was also an exaustralian the men had known each other in the colonies so that it was not unnatural that when they came to settle down they should do so as near each other as possible turner was apparently the richer man so mccarthy became his tenant but still remained it seems upon terms of perfect equality as they were frequently together mccarthy had one son a lad of eighteen and turner had an only daughter of the same age but neither of them had wives living they appear to have avoided the society of the neighbouring english families and to have led retired lives though both the mccarthys were fond of sport and were frequently seen at the racemeetings of the neighbourhood mccarthy kept two servantsa man and a girl turner had a considerable household some halfdozen at the least that is as much as i have been able to gather about the families now for the facts,0
on june 3rd that is on monday last mccarthy left his house at hatherley about three in the afternoon and walked down to the boscombe pool which is a small lake formed by the spreading out of the stream which runs down the boscombe valley he had been out with his servingman in the morning at ross and he had told the man that he must hurry as he had an appointment of importance to keep at three from that appointment he never came back alive,0
from hatherley farmhouse to the boscombe pool is a quarter of a mile and two people saw him as he passed over this ground one was an old woman whose name is not mentioned and the other was william crowder a gamekeeper in the employ of mr turner both these witnesses depose that mr mccarthy was walking alone the gamekeeper adds that within a few minutes of his seeing mr mccarthy pass he had seen his son mr james mccarthy going the same way with a gun under his arm to the best of his belief the father was actually in sight at the time and the son was following him he thought no more of the matter until he heard in the evening of the tragedy that had occurred,0
the two mccarthys were seen after the time when william crowder the gamekeeper lost sight of them the boscombe pool is thickly wooded round with just a fringe of grass and of reeds round the edge a girl of fourteen patience moran who is the daughter of the lodgekeeper of the boscombe valley estate was in one of the woods picking flowers she states that while she was there she saw at the border of the wood and close by the lake mr mccarthy and his son and that they appeared to be having a violent quarrel she heard mr mccarthy the elder using very strong language to his son and she saw the latter raise up his hand as if to strike his father she was so frightened by their violence that she ran away and told her mother when she reached home that she had left the two mccarthys quarrelling near boscombe pool and that she was afraid that they were going to fight she had hardly said the words when young mr mccarthy came running up to the lodge to say that he had found his father dead in the wood and to ask for the help of the lodgekeeper he was much excited without either his gun or his hat and his right hand and sleeve were observed to be stained with fresh blood on following him they found the dead body stretched out upon the grass beside the pool the head had been beaten in by repeated blows of some heavy and blunt weapon the injuries were such as might very well have been inflicted by the buttend of his sons gun which was found lying on the grass within a few paces of the body under these circumstances the young man was instantly arrested and a verdict of wilful murder having been returned at the inquest on tuesday he was on wednesday brought before the magistrates at ross who have referred the case to the next assizes those are the main facts of the case as they came out before the coroner and the policecourt,0
i could hardly imagine a more damning case i remarked if ever circumstantial evidence pointed to a criminal it does so here,0
circumstantial evidence is a very tricky thing answered holmes thoughtfully it may seem to point very straight to one thing but if you shift your own point of view a little you may find it pointing in an equally uncompromising manner to something entirely different it must be confessed however that the case looks exceedingly grave against the young man and it is very possible that he is indeed the culprit there are several people in the neighbourhood however and among them miss turner the daughter of the neighbouring landowner who believe in his innocence and who have retained lestrade whom you may recollect in connection with the study in scarlet to work out the case in his interest lestrade being rather puzzled has referred the case to me and hence it is that two middleaged gentlemen are flying westward at fifty miles an hour instead of quietly digesting their breakfasts at home,0
i am afraid said i that the facts are so obvious that you will find little credit to be gained out of this case,0
there is nothing more deceptive than an obvious fact he answered laughing besides we may chance to hit upon some other obvious facts which may have been by no means obvious to mr lestrade you know me too well to think that i am boasting when i say that i shall either confirm or destroy his theory by means which he is quite incapable of employing or even of understanding to take the first example to hand i very clearly perceive that in your bedroom the window is upon the righthand side and yet i question whether mr lestrade would have noted even so selfevident a thing as that,0
how on earth,0
my dear fellow i know you well i know the military neatness which characterises you you shave every morning and in this season you shave by the sunlight but since your shaving is less and less complete as we get farther back on the left side until it becomes positively slovenly as we get round the angle of the jaw it is surely very clear that that side is less illuminated than the other i could not imagine a man of your habits looking at himself in an equal light and being satisfied with such a result i only quote this as a trivial example of observation and inference therein lies my mtier and it is just possible that it may be of some service in the investigation which lies before us there are one or two minor points which were brought out in the inquest and which are worth considering,0
what are they,0
it appears that his arrest did not take place at once but after the return to hatherley farm on the inspector of constabulary informing him that he was a prisoner he remarked that he was not surprised to hear it and that it was no more than his deserts this observation of his had the natural effect of removing any traces of doubt which might have remained in the minds of the coroners jury,0
it was a confession i ejaculated,0
no for it was followed by a protestation of innocence,0
coming on the top of such a damning series of events it was at least a most suspicious remark,0
on the contrary said holmes it is the brightest rift which i can at present see in the clouds however innocent he might be he could not be such an absolute imbecile as not to see that the circumstances were very black against him had he appeared surprised at his own arrest or feigned indignation at it i should have looked upon it as highly suspicious because such surprise or anger would not be natural under the circumstances and yet might appear to be the best policy to a scheming man his frank acceptance of the situation marks him as either an innocent man or else as a man of considerable selfrestraint and firmness as to his remark about his deserts it was also not unnatural if you consider that he stood beside the dead body of his father and that there is no doubt that he had that very day so far forgotten his filial duty as to bandy words with him and even according to the little girl whose evidence is so important to raise his hand as if to strike him the selfreproach and contrition which are displayed in his remark appear to me to be the signs of a healthy mind rather than of a guilty one,0
i shook my head many men have been hanged on far slighter evidence i remarked,0
so they have and many men have been wrongfully hanged,0
what is the young mans own account of the matter,0
it is i am afraid not very encouraging to his supporters though there are one or two points in it which are suggestive you will find it here and may read it for yourself,0
he picked out from his bundle a copy of the local herefordshire paper and having turned down the sheet he pointed out the paragraph in which the unfortunate young man had given his own statement of what had occurred i settled myself down in the corner of the carriage and read it very carefully it ran in this way,0
mr james mccarthy the only son of the deceased was then called and gave evidence as follows i had been away from home for three days at bristol and had only just returned upon the morning of last monday the 3rd my father was absent from home at the time of my arrival and i was informed by the maid that he had driven over to ross with john cobb the groom shortly after my return i heard the wheels of his trap in the yard and looking out of my window i saw him get out and walk rapidly out of the yard though i was not aware in which direction he was going i then took my gun and strolled out in the direction of the boscombe pool with the intention of visiting the rabbit warren which is upon the other side on my way i saw william crowder the gamekeeper as he had stated in his evidence but he is mistaken in thinking that i was following my father i had no idea that he was in front of me when about a hundred yards from the pool i heard a cry of cooee which was a usual signal between my father and myself i then hurried forward and found him standing by the pool he appeared to be much surprised at seeing me and asked me rather roughly what i was doing there a conversation ensued which led to high words and almost to blows for my father was a man of a very violent temper seeing that his passion was becoming ungovernable i left him and returned towards hatherley farm i had not gone more than 150 yards however when i heard a hideous outcry behind me which caused me to run back again i found my father expiring upon the ground with his head terribly injured i dropped my gun and held him in my arms but he almost instantly expired i knelt beside him for some minutes and then made my way to mr turners lodgekeeper his house being the nearest to ask for assistance i saw no one near my father when i returned and i have no idea how he came by his injuries he was not a popular man being somewhat cold and forbidding in his manners but he had as far as i know no active enemies i know nothing further of the matter,0
the coroner did your father make any statement to you before he died,0
witness he mumbled a few words but i could only catch some allusion to a rat,0
the coroner what did you understand by that,0
witness it conveyed no meaning to me i thought that he was delirious,0
the coroner what was the point upon which you and your father had this final quarrel,0
witness i should prefer not to answer,0
the coroner i am afraid that i must press it,0
witness it is really impossible for me to tell you i can assure you that it has nothing to do with the sad tragedy which followed,0
the coroner that is for the court to decide i need not point out to you that your refusal to answer will prejudice your case considerably in any future proceedings which may arise,0
witness i must still refuse,0
the coroner i understand that the cry of cooee was a common signal between you and your father,0
witness it was,0
the coroner how was it then that he uttered it before he saw you and before he even knew that you had returned from bristol,0
witness with considerable confusion i do not know,0
a juryman did you see nothing which aroused your suspicions when you returned on hearing the cry and found your father fatally injured,0
witness nothing definite,0
the coroner what do you mean,0
witness i was so disturbed and excited as i rushed out into the open that i could think of nothing except of my father yet i have a vague impression that as i ran forward something lay upon the ground to the left of me it seemed to me to be something grey in colour a coat of some sort or a plaid perhaps when i rose from my father i looked round for it but it was gone,0
 do you mean that it disappeared before you went for help,0
 yes it was gone,0
 you cannot say what it was,0
 no i had a feeling something was there,0
 how far from the body,0
 a dozen yards or so,0
 and how far from the edge of the wood,0
 about the same,0
 then if it was removed it was while you were within a dozen yards of it,0
 yes but with my back towards it,0
this concluded the examination of the witness,0
i see said i as i glanced down the column that the coroner in his concluding remarks was rather severe upon young mccarthy he calls attention and with reason to the discrepancy about his father having signalled to him before seeing him also to his refusal to give details of his conversation with his father and his singular account of his fathers dying words they are all as he remarks very much against the son,0
holmes laughed softly to himself and stretched himself out upon the cushioned seat both you and the coroner have been at some pains said he to single out the very strongest points in the young mans favour dont you see that you alternately give him credit for having too much imagination and too little too little if he could not invent a cause of quarrel which would give him the sympathy of the jury too much if he evolved from his own inner consciousness anything so outr as a dying reference to a rat and the incident of the vanishing cloth no sir i shall approach this case from the point of view that what this young man says is true and we shall see whither that hypothesis will lead us and now here is my pocket petrarch and not another word shall i say of this case until we are on the scene of action we lunch at swindon and i see that we shall be there in twenty minutes,0
it was nearly four oclock when we at last after passing through the beautiful stroud valley and over the broad gleaming severn found ourselves at the pretty little countrytown of ross a lean ferretlike man furtive and slylooking was waiting for us upon the platform in spite of the light brown dustcoat and leatherleggings which he wore in deference to his rustic surroundings i had no difficulty in recognising lestrade of scotland yard with him we drove to the hereford arms where a room had already been engaged for us,0
i have ordered a carriage said lestrade as we sat over a cup of tea i knew your energetic nature and that you would not be happy until you had been on the scene of the crime,0
it was very nice and complimentary of you holmes answered it is entirely a question of barometric pressure,0
lestrade looked startled i do not quite follow he said,0
how is the glass twentynine i see no wind and not a cloud in the sky i have a caseful of cigarettes here which need smoking and the sofa is very much superior to the usual country hotel abomination i do not think that it is probable that i shall use the carriage tonight,0
lestrade laughed indulgently you have no doubt already formed your conclusions from the newspapers he said the case is as plain as a pikestaff and the more one goes into it the plainer it becomes still of course one cant refuse a lady and such a very positive one too she has heard of you and would have your opinion though i repeatedly told her that there was nothing which you could do which i had not already done why bless my soul here is her carriage at the door,0
he had hardly spoken before there rushed into the room one of the most lovely young women that i have ever seen in my life her violet eyes shining her lips parted a pink flush upon her cheeks all thought of her natural reserve lost in her overpowering excitement and concern,0
oh mr sherlock holmes she cried glancing from one to the other of us and finally with a womans quick intuition fastening upon my companion i am so glad that you have come i have driven down to tell you so i know that james didnt do it i know it and i want you to start upon your work knowing it too never let yourself doubt upon that point we have known each other since we were little children and i know his faults as no one else does but he is too tenderhearted to hurt a fly such a charge is absurd to anyone who really knows him,0
i hope we may clear him miss turner said sherlock holmes you may rely upon my doing all that i can,0
but you have read the evidence you have formed some conclusion do you not see some loophole some flaw do you not yourself think that he is innocent,0
i think that it is very probable,0
there now she cried throwing back her head and looking defiantly at lestrade you hear he gives me hopes,0
lestrade shrugged his shoulders i am afraid that my colleague has been a little quick in forming his conclusions he said,0
but he is right oh i know that he is right james never did it and about his quarrel with his father i am sure that the reason why he would not speak about it to the coroner was because i was concerned in it,0
in what way asked holmes,0
it is no time for me to hide anything james and his father had many disagreements about me mr mccarthy was very anxious that there should be a marriage between us james and i have always loved each other as brother and sister but of course he is young and has seen very little of life yet andandwell he naturally did not wish to do anything like that yet so there were quarrels and this i am sure was one of them,0
and your father asked holmes was he in favour of such a union,0
no he was averse to it also no one but mr mccarthy was in favour of it a quick blush passed over her fresh young face as holmes shot one of his keen questioning glances at her,0
thank you for this information said he may i see your father if i call tomorrow,0
i am afraid the doctor wont allow it,0
the doctor,0
yes have you not heard poor father has never been strong for years back but this has broken him down completely he has taken to his bed and dr willows says that he is a wreck and that his nervous system is shattered mr mccarthy was the only man alive who had known dad in the old days in victoria,0
ha in victoria that is important,0
yes at the mines,0
quite so at the goldmines where as i understand mr turner made his money,0
yes certainly,0
thank you miss turner you have been of material assistance to me,0
you will tell me if you have any news tomorrow no doubt you will go to the prison to see james oh if you do mr holmes do tell him that i know him to be innocent,0
i will miss turner,0
i must go home now for dad is very ill and he misses me so if i leave him goodbye and god help you in your undertaking she hurried from the room as impulsively as she had entered and we heard the wheels of her carriage rattle off down the street,0
i am ashamed of you holmes said lestrade with dignity after a few minutes silence why should you raise up hopes which you are bound to disappoint i am not overtender of heart but i call it cruel,0
i think that i see my way to clearing james mccarthy said holmes have you an order to see him in prison,0
yes but only for you and me,0
then i shall reconsider my resolution about going out we have still time to take a train to hereford and see him tonight,0
ample,0
then let us do so watson i fear that you will find it very slow but i shall only be away a couple of hours,0
