he certainly needs a wash remarked holmes i had an idea that he might and i took the liberty of bringing the tools with me he opened the gladstone bag as he spoke and took out to my astonishment a very large bathsponge,0
he he you are a funny one chuckled the inspector,0
now if you will have the great goodness to open that door very quietly we will soon make him cut a much more respectable figure,0
well i dont know why not said the inspector he doesnt look a credit to the bow street cells does he he slipped his key into the lock and we all very quietly entered the cell the sleeper half turned and then settled down once more into a deep slumber holmes stooped to the waterjug moistened his sponge and then rubbed it twice vigorously across and down the prisoners face,0
let me introduce you he shouted to mr neville st clair of lee in the county of kent,0
never in my life have i seen such a sight the mans face peeled off under the sponge like the bark from a tree gone was the coarse brown tint gone too was the horrid scar which had seamed it across and the twisted lip which had given the repulsive sneer to the face a twitch brought away the tangled red hair and there sitting up in his bed was a pale sadfaced refinedlooking man blackhaired and smoothskinned rubbing his eyes and staring about him with sleepy bewilderment then suddenly realising the exposure he broke into a scream and threw himself down with his face to the pillow,0
great heavens cried the inspector it is indeed the missing man i know him from the photograph,0
the prisoner turned with the reckless air of a man who abandons himself to his destiny be it so said he and pray what am i charged with,0
with making away with mr neville st oh come you cant be charged with that unless they make a case of attempted suicide of it said the inspector with a grin well i have been twentyseven years in the force but this really takes the cake,0
if i am mr neville st clair then it is obvious that no crime has been committed and that therefore i am illegally detained,0
no crime but a very great error has been committed said holmes you would have done better to have trusted you wife,0
it was not the wife it was the children groaned the prisoner god help me i would not have them ashamed of their father my god what an exposure what can i do,0
sherlock holmes sat down beside him on the couch and patted him kindly on the shoulder,0
if you leave it to a court of law to clear the matter up said he of course you can hardly avoid publicity on the other hand if you convince the police authorities that there is no possible case against you i do not know that there is any reason that the details should find their way into the papers inspector bradstreet would i am sure make notes upon anything which you might tell us and submit it to the proper authorities the case would then never go into court at all,0
god bless you cried the prisoner passionately i would have endured imprisonment ay even execution rather than have left my miserable secret as a family blot to my children,0
you are the first who have ever heard my story my father was a schoolmaster in chesterfield where i received an excellent education i travelled in my youth took to the stage and finally became a reporter on an evening paper in london one day my editor wished to have a series of articles upon begging in the metropolis and i volunteered to supply them there was the point from which all my adventures started it was only by trying begging as an amateur that i could get the facts upon which to base my articles when an actor i had of course learned all the secrets of making up and had been famous in the greenroom for my skill i took advantage now of my attainments i painted my face and to make myself as pitiable as possible i made a good scar and fixed one side of my lip in a twist by the aid of a small slip of fleshcoloured plaster then with a red head of hair and an appropriate dress i took my station in the business part of the city ostensibly as a matchseller but really as a beggar for seven hours i plied my trade and when i returned home in the evening i found to my surprise that i had received no less than 26s 4d,0
i wrote my articles and thought little more of the matter until some time later i backed a bill for a friend and had a writ served upon me for 25 i was at my wits end where to get the money but a sudden idea came to me i begged a fortnights grace from the creditor asked for a holiday from my employers and spent the time in begging in the city under my disguise in ten days i had the money and had paid the debt,0
well you can imagine how hard it was to settle down to arduous work at 2 a week when i knew that i could earn as much in a day by smearing my face with a little paint laying my cap on the ground and sitting still it was a long fight between my pride and the money but the dollars won at last and i threw up reporting and sat day after day in the corner which i had first chosen inspiring pity by my ghastly face and filling my pockets with coppers only one man knew my secret he was the keeper of a low den in which i used to lodge in swandam lane where i could every morning emerge as a squalid beggar and in the evenings transform myself into a welldressed man about town this fellow a lascar was well paid by me for his rooms so that i knew that my secret was safe in his possession,0
well very soon i found that i was saving considerable sums of money i do not mean that any beggar in the streets of london could earn 700 a yearwhich is less than my average takingsbut i had exceptional advantages in my power of making up and also in a facility of repartee which improved by practice and made me quite a recognised character in the city all day a stream of pennies varied by silver poured in upon me and it was a very bad day in which i failed to take 2,0
as i grew richer i grew more ambitious took a house in the country and eventually married without anyone having a suspicion as to my real occupation my dear wife knew that i had business in the city she little knew what,0
last monday i had finished for the day and was dressing in my room above the opium den when i looked out of my window and saw to my horror and astonishment that my wife was standing in the street with her eyes fixed full upon me i gave a cry of surprise threw up my arms to cover my face and rushing to my confidant the lascar entreated him to prevent anyone from coming up to me i heard her voice downstairs but i knew that she could not ascend swiftly i threw off my clothes pulled on those of a beggar and put on my pigments and wig even a wifes eyes could not pierce so complete a disguise but then it occurred to me that there might be a search in the room and that the clothes might betray me i threw open the window reopening by my violence a small cut which i had inflicted upon myself in the bedroom that morning then i seized my coat which was weighted by the coppers which i had just transferred to it from the leather bag in which i carried my takings i hurled it out of the window and it disappeared into the thames the other clothes would have followed but at that moment there was a rush of constables up the stair and a few minutes after i found rather i confess to my relief that instead of being identified as mr neville st clair i was arrested as his murderer,0
i do not know that there is anything else for me to explain i was determined to preserve my disguise as long as possible and hence my preference for a dirty face knowing that my wife would be terribly anxious i slipped off my ring and confided it to the lascar at a moment when no constable was watching me together with a hurried scrawl telling her that she had no cause to fear,0
that note only reached her yesterday said holmes,0
good god what a week she must have spent,0
the police have watched this lascar said inspector bradstreet and i can quite understand that he might find it difficult to post a letter unobserved probably he handed it to some sailor customer of his who forgot all about it for some days,0
that was it said holmes nodding approvingly i have no doubt of it but have you never been prosecuted for begging,0
many times but what was a fine to me,0
it must stop here however said bradstreet if the police are to hush this thing up there must be no more of hugh boone,0
i have sworn it by the most solemn oaths which a man can take,0
in that case i think that it is probable that no further steps may be taken but if you are found again then all must come out i am sure mr holmes that we are very much indebted to you for having cleared the matter up i wish i knew how you reach your results,0
i reached this one said my friend by sitting upon five pillows and consuming an ounce of shag i think watson that if we drive to baker street we shall just be in time for breakfast,0
vii the adventure of the blue carbuncle,0
i had called upon my friend sherlock holmes upon the second morning after christmas with the intention of wishing him the compliments of the season he was lounging upon the sofa in a purple dressinggown a piperack within his reach upon the right and a pile of crumpled morning papers evidently newly studied near at hand beside the couch was a wooden chair and on the angle of the back hung a very seedy and disreputable hardfelt hat much the worse for wear and cracked in several places a lens and a forceps lying upon the seat of the chair suggested that the hat had been suspended in this manner for the purpose of examination,0
you are engaged said i perhaps i interrupt you,0
not at all i am glad to have a friend with whom i can discuss my results the matter is a perfectly trivial onehe jerked his thumb in the direction of the old hatbut there are points in connection with it which are not entirely devoid of interest and even of instruction,0
i seated myself in his armchair and warmed my hands before his crackling fire for a sharp frost had set in and the windows were thick with the ice crystals i suppose i remarked that homely as it looks this thing has some deadly story linked on to itthat it is the clue which will guide you in the solution of some mystery and the punishment of some crime,0
no no no crime said sherlock holmes laughing only one of those whimsical little incidents which will happen when you have four million human beings all jostling each other within the space of a few square miles amid the action and reaction of so dense a swarm of humanity every possible combination of events may be expected to take place and many a little problem will be presented which may be striking and bizarre without being criminal we have already had experience of such,0
so much so i remarked that of the last six cases which i have added to my notes three have been entirely free of any legal crime,0
precisely you allude to my attempt to recover the irene adler papers to the singular case of miss mary sutherland and to the adventure of the man with the twisted lip well i have no doubt that this small matter will fall into the same innocent category you know peterson the commissionaire,0
it is to him that this trophy belongs,0
it is his hat,0
no no he found it its owner is unknown i beg that you will look upon it not as a battered billycock but as an intellectual problem and first as to how it came here it arrived upon christmas morning in company with a good fat goose which is i have no doubt roasting at this moment in front of petersons fire the facts are these about four oclock on christmas morning peterson who as you know is a very honest fellow was returning from some small jollification and was making his way homeward down tottenham court road in front of him he saw in the gaslight a tallish man walking with a slight stagger and carrying a white goose slung over his shoulder as he reached the corner of goodge street a row broke out between this stranger and a little knot of roughs one of the latter knocked off the mans hat on which he raised his stick to defend himself and swinging it over his head smashed the shop window behind him peterson had rushed forward to protect the stranger from his assailants but the man shocked at having broken the window and seeing an officiallooking person in uniform rushing towards him dropped his goose took to his heels and vanished amid the labyrinth of small streets which lie at the back of tottenham court road the roughs had also fled at the appearance of peterson so that he was left in possession of the field of battle and also of the spoils of victory in the shape of this battered hat and a most unimpeachable christmas goose,0
which surely he restored to their owner,0
my dear fellow there lies the problem it is true that for mrs henry baker was printed upon a small card which was tied to the birds left leg and it is also true that the initials h b are legible upon the lining of this hat but as there are some thousands of bakers and some hundreds of henry bakers in this city of ours it is not easy to restore lost property to any one of them,0
what then did peterson do,0
he brought round both hat and goose to me on christmas morning knowing that even the smallest problems are of interest to me the goose we retained until this morning when there were signs that in spite of the slight frost it would be well that it should be eaten without unnecessary delay its finder has carried it off therefore to fulfil the ultimate destiny of a goose while i continue to retain the hat of the unknown gentleman who lost his christmas dinner,0
did he not advertise,0
then what clue could you have as to his identity,0
only as much as we can deduce,0
from his hat,0
but you are joking what can you gather from this old battered felt,0
here is my lens you know my methods what can you gather yourself as to the individuality of the man who has worn this article,0
i took the tattered object in my hands and turned it over rather ruefully it was a very ordinary black hat of the usual round shape hard and much the worse for wear the lining had been of red silk but was a good deal discoloured there was no makers name but as holmes had remarked the initials h b were scrawled upon one side it was pierced in the brim for a hatsecurer but the elastic was missing for the rest it was cracked exceedingly dusty and spotted in several places although there seemed to have been some attempt to hide the discoloured patches by smearing them with ink,0
i can see nothing said i handing it back to my friend,0
on the contrary watson you can see everything you fail however to reason from what you see you are too timid in drawing your inferences,0
then pray tell me what it is that you can infer from this hat,0
he picked it up and gazed at it in the peculiar introspective fashion which was characteristic of him it is perhaps less suggestive than it might have been he remarked and yet there are a few inferences which are very distinct and a few others which represent at least a strong balance of probability that the man was highly intellectual is of course obvious upon the face of it and also that he was fairly welltodo within the last three years although he has now fallen upon evil days he had foresight but has less now than formerly pointing to a moral retrogression which when taken with the decline of his fortunes seems to indicate some evil influence probably drink at work upon him this may account also for the obvious fact that his wife has ceased to love him,0
my dear holmes,0
he has however retained some degree of selfrespect he continued disregarding my remonstrance he is a man who leads a sedentary life goes out little is out of training entirely is middleaged has grizzled hair which he has had cut within the last few days and which he anoints with limecream these are the more patent facts which are to be deduced from his hat also by the way that it is extremely improbable that he has gas laid on in his house,0
you are certainly joking holmes,0
not in the least is it possible that even now when i give you these results you are unable to see how they are attained,0
i have no doubt that i am very stupid but i must confess that i am unable to follow you for example how did you deduce that this man was intellectual,0
for answer holmes clapped the hat upon his head it came right over the forehead and settled upon the bridge of his nose it is a question of cubic capacity said he a man with so large a brain must have something in it,0
the decline of his fortunes then,0
this hat is three years old these flat brims curled at the edge came in then it is a hat of the very best quality look at the band of ribbed silk and the excellent lining if this man could afford to buy so expensive a hat three years ago and has had no hat since then he has assuredly gone down in the world,0
well that is clear enough certainly but how about the foresight and the moral retrogression,0
sherlock holmes laughed here is the foresight said he putting his finger upon the little disc and loop of the hatsecurer they are never sold upon hats if this man ordered one it is a sign of a certain amount of foresight since he went out of his way to take this precaution against the wind but since we see that he has broken the elastic and has not troubled to replace it it is obvious that he has less foresight now than formerly which is a distinct proof of a weakening nature on the other hand he has endeavoured to conceal some of these stains upon the felt by daubing them with ink which is a sign that he has not entirely lost his selfrespect,0
your reasoning is certainly plausible,0
the further points that he is middleaged that his hair is grizzled that it has been recently cut and that he uses limecream are all to be gathered from a close examination of the lower part of the lining the lens discloses a large number of hairends clean cut by the scissors of the barber they all appear to be adhesive and there is a distinct odour of limecream this dust you will observe is not the gritty grey dust of the street but the fluffy brown dust of the house showing that it has been hung up indoors most of the time while the marks of moisture upon the inside are proof positive that the wearer perspired very freely and could therefore hardly be in the best of training,0
but his wifeyou said that she had ceased to love him,0
this hat has not been brushed for weeks when i see you my dear watson with a weeks accumulation of dust upon your hat and when your wife allows you to go out in such a state i shall fear that you also have been unfortunate enough to lose your wifes affection,0
but he might be a bachelor,0
nay he was bringing home the goose as a peaceoffering to his wife remember the card upon the birds leg,0
you have an answer to everything but how on earth do you deduce that the gas is not laid on in his house,0
one tallow stain or even two might come by chance but when i see no less than five i think that there can be little doubt that the individual must be brought into frequent contact with burning tallowwalks upstairs at night probably with his hat in one hand and a guttering candle in the other anyhow he never got tallowstains from a gasjet are you satisfied,0
well it is very ingenious said i laughing but since as you said just now there has been no crime committed and no harm done save the loss of a goose all this seems to be rather a waste of energy,0
sherlock holmes had opened his mouth to reply when the door flew open and peterson the commissionaire rushed into the apartment with flushed cheeks and the face of a man who is dazed with astonishment,0
the goose mr holmes the goose sir he gasped,0
eh what of it then has it returned to life and flapped off through the kitchen window holmes twisted himself round upon the sofa to get a fairer view of the mans excited face,0
see here sir see what my wife found in its crop he held out his hand and displayed upon the centre of the palm a brilliantly scintillating blue stone rather smaller than a bean in size but of such purity and radiance that it twinkled like an electric point in the dark hollow of his hand,0
sherlock holmes sat up with a whistle by jove peterson said he this is treasure trove indeed i suppose you know what you have got,0
a diamond sir a precious stone it cuts into glass as though it were putty,0
its more than a precious stone it is the precious stone,0
not the countess of morcars blue carbuncle i ejaculated,0
precisely so i ought to know its size and shape seeing that i have read the advertisement about it in the times every day lately it is absolutely unique and its value can only be conjectured but the reward offered of 1000 is certainly not within a twentieth part of the market price,0
a thousand pounds great lord of mercy the commissionaire plumped down into a chair and stared from one to the other of us,0
that is the reward and i have reason to know that there are sentimental considerations in the background which would induce the countess to part with half her fortune if she could but recover the gem,0
it was lost if i remember aright at the hotel cosmopolitan i remarked,0
precisely so on december 22nd just five days ago john horner a plumber was accused of having abstracted it from the ladys jewelcase the evidence against him was so strong that the case has been referred to the assizes i have some account of the matter here i believe he rummaged amid his newspapers glancing over the dates until at last he smoothed one out doubled it over and read the following paragraph,0
hotel cosmopolitan jewel robbery john horner 26 plumber was brought up upon the charge of having upon the 22nd inst abstracted from the jewelcase of the countess of morcar the valuable gem known as the blue carbuncle james ryder upperattendant at the hotel gave his evidence to the effect that he had shown horner up to the dressingroom of the countess of morcar upon the day of the robbery in order that he might solder the second bar of the grate which was loose he had remained with horner some little time but had finally been called away on returning he found that horner had disappeared that the bureau had been forced open and that the small morocco casket in which as it afterwards transpired the countess was accustomed to keep her jewel was lying empty upon the dressingtable ryder instantly gave the alarm and horner was arrested the same evening but the stone could not be found either upon his person or in his rooms catherine cusack maid to the countess deposed to having heard ryders cry of dismay on discovering the robbery and to having rushed into the room where she found matters as described by the last witness inspector bradstreet b division gave evidence as to the arrest of horner who struggled frantically and protested his innocence in the strongest terms evidence of a previous conviction for robbery having been given against the prisoner the magistrate refused to deal summarily with the offence but referred it to the assizes horner who had shown signs of intense emotion during the proceedings fainted away at the conclusion and was carried out of court,0
hum so much for the policecourt said holmes thoughtfully tossing aside the paper the question for us now to solve is the sequence of events leading from a rifled jewelcase at one end to the crop of a goose in tottenham court road at the other you see watson our little deductions have suddenly assumed a much more important and less innocent aspect here is the stone the stone came from the goose and the goose came from mr henry baker the gentleman with the bad hat and all the other characteristics with which i have bored you so now we must set ourselves very seriously to finding this gentleman and ascertaining what part he has played in this little mystery to do this we must try the simplest means first and these lie undoubtedly in an advertisement in all the evening papers if this fail i shall have recourse to other methods,0
what will you say,0
give me a pencil and that slip of paper now then found at the corner of goodge street a goose and a black felt hat mr henry baker can have the same by applying at 630 this evening at 221b baker street that is clear and concise,0
very but will he see it,0
well he is sure to keep an eye on the papers since to a poor man the loss was a heavy one he was clearly so scared by his mischance in breaking the window and by the approach of peterson that he thought of nothing but flight but since then he must have bitterly regretted the impulse which caused him to drop his bird then again the introduction of his name will cause him to see it for everyone who knows him will direct his attention to it here you are peterson run down to the advertising agency and have this put in the evening papers,0
in which sir,0
oh in the globe star pall mall st jamess evening news standard echo and any others that occur to you,0
very well sir and this stone,0
ah yes i shall keep the stone thank you and i say peterson just buy a goose on your way back and leave it here with me for we must have one to give to this gentleman in place of the one which your family is now devouring,0
