 arsenal ki arse ma nal fit karega balo christmasmanayengelondonme,1
 so jaa baby doll mom aa jayengi daant parhegi agar kp aayega to kisiko reply nahi karega likh ke lele ,1
merit engagement ki news sun k tou koi sad songs sun k mjje yaad b nhe karega sadlife,1
new friendz welcome and add me in close awl jo b close ma add karega like and comment milega lt3 ,1
 aur maine socha tu khud 8 ke pehle ungli karega aur plan banayega p ,1
 and then abuse our mufflerman in front of camera vote k liye saalakuch v karega,1
 mujhe krke koi fayda v ni p waiting for baby trailer karega kon p,1
 krk bhai maa 2 aarahi hai kutte ka role karega,1
 kursi ka chatora bahut khatarnak hota haicm banane par 2000 ko mar dalta haipm banane par kitne khoon karega,1
 she knws a lot more than 10 modis combined gujrat ka nuksaan kiya ab desh ka karega,1
 haan sindhi aisa karega na tu toh frre ki teri g bhi maar lenge log p,1
gonaa mute him sabse baat karega bus mujhse prblm hai ,1
 abe jha2 bak bak band karega ki joota khayega,1
 raat bhar koi trend karega mere saath p waiting for baby trailer,1
 ab tu jisse bhi baat karega usse bhai bulva dunga tujhe v bhaijaan ke fans pe bhai suit hota h p,1
 nagin dance karega tu or bond goli maar dega tujhe naag smhajkar pixschoolofbonding,1
plz like karo meri page and share bhi jo like karega usko frd req karungi promiss ,1
 koi bewakoof he hoga bcjo inti sardiyo mein apni gf se breakup karega,1
koi bewakoof he hoga bcjo inti sardiyo mein apni gf se breakup karega,1
 r tmhari taref tm khd nai krta to koi r kya karegad,1
 vote ke liye kuch bhi karega lol today in kishtwar pm modiji used the words allah tala in his speech go,1
 ashish jha jaise halfline pe moonwalk karega he actually did moonwalk in ajmer ,1
 he will not answaer you rather we shud know ek chamcha dusre chamche se hi baat karega,1
 me too they should get a taste of kraziness saare tweets parh ke toh karan bhi blush karega ,1
 bhakto ka sher ek dhongi rampal ko arrest nahi kar pa raha aur bhakts chinapakistan ko mitane ki khwahis rakhe hue hai,1
 you lifafa kute dalay tm awam k taxu pr palne wala kuta hai jo nawz tmare smne dal raha hai harami,1
 lolye janwar bhee soch raha ho ga kis ka name likh dya ,1
 evening guys look at my necklace hehehejaan necklace to dikh hi ni raha,1
 kya chal raha hai d,1
 ji me to jaag raha hu p,1
 sub dikh raha hai jubhi tu bik raha hai p lolz,1
