 pta ni aaj mobile kesay bach gya dil tor diya,1
 aaj maine sab ko phir se sunaya bahot maar padi d,1
 dont knw y aaj kyun itana yaad aa rahe ho n i cant stop myself frm makng dis taarey httpt,1
 aap ny tl py topic dekha aaj kia chal raha d,1
 hahahahahah piers k ghar walo ki kher nahi aaj ,1
 khairaat bhi aaj kal khairaat me nahi milti uske badle bhi log dua ki umeed rakhte hain ,1
 plz chand aap apna khayal rakhiye baby n so jayiye meri neend toh poori tarah gul hai aaj ,1
 tay phir ki hoya d asal din tou aaj hay trend krny ka d tou mein tou aaj he karun gi d,1
im still tryna figure out what sonali was wearin woh bhi aise jagah mein bb8,1
 sonali applied for a bus pass from upens house to gautams houseana jana badh jayega na abek jagah tikegi kaha madam,1
 fatima khan ki jagah naak waali khaan naam rakh lo na ,1
 ja rakha hu idhar bhi taste to har jagah same hi rehta hai bas logon ke khane ka tarika alag hota hai har jagah ,1
 love u papa jiitna love u jitni jagah main aapka noor samya hai,1
 plz chand dnt say again k u are alone coz har ek pal har jagah hoon main aapke saath aapke paas ,1
 ohh sorry har jagah happy birthday karan patel likh rahi thito galti se ho gaya ,1
 dushmani or pyar soch k nahi hotiso u r dushman now soch to aap low jis jagah poz mar k khade ho p,1
 bc kitni jagah yehi post copy paste ki hui dikhegi ab aur,1
happy birthday karan patel 40 degree temp h aur mujhe challis jagah se paseena aa raha h aur tumhe weather ki padi hai,1
 hahahaha tum toh har jagah se phanse hue ho p,1
haaan mazza ayega waise mei apni jagah se bor ho chuka hu ,1
 ha tu bhi aa ja achi jagah hai ,1
 madharchoooooood sale kejriwall jisdin samne aaya na mere sale ko aisi jagah pr aisa dard dunga ki kursi dekhkar hi bhagega ,1
 lo ab nautanki chaluaisa lag rha h aankho se anso ki jagah paraathe k saath wali hari chutney nikal rahi h ,1
 kaisa he be chutiyeharr jagah ghusne ma he tereko khaya naaa sona se gaalihahahahaabha,1
parade bhi german sena kare bharatiya sena ki jagah to 4 chand lag jayenge hitler to aap maante hi hain kisi ko germindia,1
 chhodo yar dono fan bases mei aise gadhe hai will ignore such people aur nafrat ke liye jagah nahi hai ,1
mere maheboob kya tumhe hai kabarhar jagah tumko dhundti hai nazardekh ke tumko jita marta huhar ghadi tumko yaad krta hu,1
deewana aashqon ki akhri jagah pagal khana to hoti h4rm66 goli wala baba,1
 see my love for afridi har jagah wohi nazar aata hai,1
 gaaliyan to khani padegi kyonki k anusar rday pe indian sena ki jagah german parade kare to issue nahi hona chaiye,1
my srkian sister followed salmankhan now psab jagah pyar he 5millionshanatics,1
ek ladki thi deewani si she ended up in mental hospital phar jagah pyar mohobbat ka masla nahi hota be practical p,1
 wewantharshikaback hosh na khabar hai yeh harshika ka asar hai zaya ko dekh ke baad dilbar dilbar dilbar,1
 hmm maybe im favouring imran cuz kam ki sad ending ke baad i wanted him to have a happy ending in a show p p,1
pasha ka hath uthni kay baad bacha nashai hogaya irejectpti,1
rawalpindi daish ka wajood arab mumalik main hai pakistan main nahi pti 30 november kay baad muzakrat ki maiz par aaye chaudhary nisar,1
 thori baqwas k baad,1
 nae phadday k baad baat hi nh karti,1
tmhare baad guzre ge bhala kaise hmare dinnovemeber se bachy ge toh december maar dalega,1
 hahahaha koi baat nai hota hai hota hai haarne k baad mein apse yehi expect kar sakta hu d,1
 wow raat ko net bht mast chalta hai ab raat ko 1 bje ke baad hi aaungi ol bhooto ki tarah,1
i feel like a fever is coming amp my body aches baad,1
meri pechan pakistanpakistan pakistanpak fouj zinda baad,1
 dekh bhai mujhe ye dosti bohot pasand hai tujhe nai hai mat kar comment pass mat kar kuch accha ho rha ,1
 shadi se pehle you complete meshadi ke baad let me complete first,1
 i have no idea ye din gande hai ,1
 job bro engg k baad lyf sucks buddydnt go fr jobaur padho ,1
 ik k baad dosra dukh nikal leta ha ,1
 hahah soch lo baad mein pachtaogay,1
 id love to do that so baad,1
tujhy hi dho0ndti then bustere baad to mar gai aankhain,1
na baad ka dekhengena pehle ka sochengebas ek ek din jiyengeaur kya pata aise hi saari zindagi kat jayegihappyending sweetshortmovie,1
he still baee it just i feel like we on baad terms ,1
 haha yeah and i was like ok he dint abuse me d and baad mein pyar se tweeted i blocked you now carry on lol,1
 haaan souti rahi mein haha mood ko kia hua,1
 lgta hy us din kuch chupany wala tha jo chupa dia hua hy ab p hmmmmmmmmmmm,1
 hai zindagi to hai khuda ki khuda se hi khuda k liye zindagi walo ko ye ilm tab hua jab zindagi unki so gayii de,1
 shabash bhtt achii bachii hein apye qmobile b apka hua,1
 loved singing this one kyun hua khafa a beautiful melody composed by arjuna harjai httpstcolrgj2slpyi http,1
 tera deedar hua pehla sa pyar huapehli hi baar hua iss dil kogud ni8 magician ,1
 tunne kandhe pe sir chukaya mehrbaan hua,1
 ohhh sahii ab meri itni umer ni ke school jao uni sey nikala hua va hun,1
meherbaan hua huaaa rab meherbaan hua rab,1
 i think app makah se pak ho kar a rahin hain acha hua app ne bedroom politics chorde heh,1
 ye log khusi se khala re ha ye hakumat ki trhaa ni ha k awam k lota hua mal khaye,1
ye a b c kia scene lagya hua ha,1
 is doran koi naya project to door kisi mohallr galli nukar pe b koi kam ni hua janab sargodha shameonpmln 22,1
 waise pura pakistan daikha hua hy ,1
urdta hua taara hoonooncha sa ik nara hoongujranwalastandswithik internationalprideik ,1
 2 days holiday for mullayums birthday sickuliars silent manhoos paida hua toh 2 din barbaad ,1
allah ka dia hua sab kch he nus aik awwww karne wali chahiye parsalan,1
 merabaan hua hua mehrabaan huamehrabaan hua rab vrimar iv itne khushi th,1
u got awsome name aapke naam ka id ka mean ab maloom huaapke tweets justifies ur name ,1
 okay thanks acha hua apne batadiyawarna hame pata hi nahi chalta ,1
 okay thanks acha hua apna batadiya ,1
 hahaha aisay hee hota hai p chalo atleast mera attitude wala ghalat impression khatam to hua p,1
 hahaha gaana hai p toh kind of shair he hua p,1
 amazingly mere sath be aisa he hua hai ess sal shaid asli dost ki pechan hou gai hai,1
 sale harami kaha ki ghatiya link deya hai pata nhi 2 3 browser install ho gae lkn song nhi hua download,1
aray twitter band nhe hua social pckage abhe nhe chal ra hai ,1
 wewantharshikaback in a few days colors will sing to me jo bheji thi baddua trps per assar hua ,1
 hahahahhachapraasi apni duty nibha raha haytaanga party mein kab sawaar huapta he ni chaladp ,1
 hahahaha jee p kia hua avi ko,1
aankh uthi muhabbat ne angrai li dil ka sauda hua chandni raat mein,1
kitabezindgi ka aik or baab khatm hua shabab khatm hua azab khatm hua ,1
 ha toh kya hua phir se dekh liya humnethanx ,1
 iska dil tuta hua hain arpita ki saadi ho gai babwa lol ha ha ha ha ha ha,1
 are to kya hua thanks for sharing v hv skipped but u again brought back it in front of our eyes ,1
 bachu koi spam hua na toh pta chale ga ,1
 hehe waise ye aaj kyu start hua outrage news to bahut purani hai,1
 football sab ekk ball ke peeche bhag rahe hain garibon ka khel bhenchoo kya interesting hai stupid game,1
 katrina ka pachtava hota hoga galti kiya usne abhi usko babaji ka thullu milegasrkianssalmaniacstogether,1
 ha ha ha slapped by obama epic fir obama ko guldasta bhi milega ,1
 ff gt ghar baithey fastest cars dekhney ka moqa mil jayegafollow kar lo aisa moqa bar bar nahi m,1
rozana kalma parhne se eman taza rehta helailahailallahmuhammadurrasulallahjis ko bhi snd kroge wo lazmi parhega or sawab milega,1
 canal dwara kam se rojgaar b milega or sath hi bhavisya me kisano k liy pani,1
 mere life main maile mere maa ko nahi dekha hai pls uncle aap mujhe just aashirwad kahinge toh mujhe sansar ke khusi milega,1
 nahi todirect mention milega to reply karu nanotifications bahut hi jyada hai,1
 sid ki shaadi ho jayegi or tujhe baba ji ka thullu milega,1
bhai isl khel le aa ke goals marne milega yaha,1
 haters go to hell,1
 raat abhi jawan hai mere dost milega town town bolke khud bandra mein chala gaya ,1
 zaroor milega after nazeem khan aap hi honge jo salmaniacs ka jalwa dikhane wale bwood me,1
 sir aapka aashirwad chahiye tki m apne hr km aasani s kr sku aapka aashirwad milega to acha lagega,1
 aaj reply nhin milega,1
 nahi milega mujh jaisa tujhe chahne waala jaa tujhe ijaazat hai saari duniya aazma le ,1
 ek bhi problem nahi milega wewantharshikaback ,1
thenga milega hum sabko wewantharshikaback,1
 ebola ka ilaj to ho hi jayega is jhuthhbola ka ilaj to nahin milega,1
 sik ka bhi faayda milega is movie ko amp if music strikes then movie will roar at bo waiting for baby trailer,1
sujawalpsf zilly sadar rabdino jat jesa sacha woker leader dost ppp ko nae milegarabdino jat party ka sarmaya haiamarjumani,1
 sir ji kamal ho gaya hot news ham kisi se kam nahi ache din aa chuke hai ab bahut kuch acha dekhne ko milega jai hind,1
 kab tak ladogeaur ladke kya milega,1
pune rickshaw walas are better than mumbai walas they never say noask bhayia mg road chaloge answer milega swargate jana hai ,1
 bwahahahamilega milega kisi aamir fan ko dhoondo,1
 pta ni ladai karke kya milega yaarjab ak sallu dost hai toh hum kyu lade,1
 hum beg karte rahenge par milega baba ji ka thullu ,1
 namaste sir bengali film piku me apko dekhne milegaham bohut khus hu ,1
 mohabbat kee raah par hamesha dard milega,1
 roz roz modi gungaan din bhar news me chalta haimodi america se kya laya kisi ne puchapak ko kab sabak milega,1
 tulsi aur adrakh ka soup pijie aaram milega ,1
aashiqui se milega aae zaahidbandagi se khuda nahi miltafollow ownrzoyakhan,1
qismat pehle hi likhi ja chukki hy to dua karne se kya milegabest anskiya pata qismat mai likha ho k jo milega dua se hi milegaali,1
 manusmriti ko vastav me samajhne k liye main kisi dalit writer k version ko padhunga to kewal buraiyaan negatives hi milega,1
 finland gaya hai toh nokia ke factory outlet se phone khareed discount milega p,1
 hahaha is baat ka kiya matlab ,1
sirf sunday ko off hota ha collegematlab k bhae zulam ki aik inteha hoti ha ,1
 hmm dil mei mail hai iska matlab ,1
 matlab mei apko kaise join krou means how will i help u ,1
tl ne paro bana diya matlab ,1
main naraaz hota hon lekin is ka matlab yeh nahi k tum ko chor diya aur tum aazaad ho aisa nahi hai waqti sub husband aur wife lartay ha ,1
 matlab kuch ho nahi raha yehi masla hai,1
 yaar aap bohat he confident hain p matlab okjbtw shughal dont get annoyed wese ho bhi jayen to sabu ki xd,1
 kia matlab maaf krdo o me ne kuch nahii kiaa dunia walooye ilzam hai muj pe judge saheb,1
teachertumhare abbu kia kam krte hen bachaups company k malik henteachr niceacha ye ups ka kia matlab hebachausman pakora shop,1
 thanks bae p mera matlab bhai d,1
 kia matlab hai apka ap se koi zabardasti thori keh rha hai live ur own life ,1
 darling aise doston ko pehli fursat mein laat maro dost woh jo bina matlab apko sikhaye aur masti mein gd bhi mare,1
 matlab phir main bhoka mr jaon tum yh chahty ho ,1
 waisii hi kuch hai ye matlab ki dosti,1
first away win at emirates bc matlab end hi hou gaya ,1
 haha kia matlab btw ye to kal hi aya hai abhi,1
 fuck matlab,1
 jo dosti matlab ki hai woh dosti kahan hui chittey ,1
 matlab nahi bholay dhaan haan yahi kahogy ab tou masoom banjaao,1
 matlab phir main inkaar he samjhon ,1
ye mufc ka matlab mother fucker hai kya p footballignorant afcvmufc,1
ye kon ae bhaiisay le jao yahan se alien aeisay matlab kew nahi pta hotay ,1
 jeetne se matlab hai ya on target shot se,1
 inni achchhi angrejji mein likha hai jaroor koi gehra matlab hoga ,1
 dekho tou kitne zayada hain xp nai dekha kal se behtar hai waise,1
 manal se pocho wohi zayada khoobsurat hai p,1
 jamaati cobra se zayada zehreela janwar hai shameonji banji hangthem,1
 hahahahahahaha tmharey liye hamesha busy rehna hai or zayada mat choro ,1
 keya khobsorat banda hain 50age k uper b aaj k jawano se zayada handsam mashaallah allah lambi aur achi zindage dy,1
i want to say something serious behenchod goa ki fanny ek peg se zayada na peena varna 3 din takk smell nahi jayegi ,1
 ye log wazarat bachany keley kuch zayada he bol jata hain ab insan k rago main khon janwar isley to ganja wehshi janwar bangaya,1
lagta hai sofia wala tweet zayada hi pasand aa gaya logon ko xp,1
 yaar diya aur baati me ye teeno criminal kam aur joker zayada lagti hai thoda to standard rakho yaar ,1
 aap ki zayada bisti nahi karain gy tweet karain msg na karain ta kay awam ko bi pata chaley aao maydan ich cha cha ji,1
 apny naam subtweets dekh k dil tot jata hai itny zayada ali k naam sy subtweets but sab koi aur ali hoty ,1
 hahahahahah kuch zayada hi tez hai ,1
 punjabi waheyat nai karakht zuban hya dunya main sb say zayada bolny waly language main 8th number pr h,1
 hahapossible usko bht zayada pasand ain houn,1
 mashallah kuch zayada der nhi hei hii keep take ur time ,1
 unfollow me if you are still defending her dimag nai lagana mujhe zayada aab aur gyaan pelne mat aana samjha deta,1
 to acha hi gaimazdoor ki ujrat zayada honi chaiy ye stupid question hai apka,1
sharjeel memon ne kaha hai larkana me corner meeting thee per loug yo karachi zardari ke jalsa se bhi zayada thy phir wo kon c meeting thee,1
dear mom apni bahoo select kartay waqt unko bta daina se zayada kisi se payar nai iskogujranwalastandswithik,1
 absar alam jesa 2 taka k log imran ko challange kerta hain tumhari okat aik gutter k worm sa zayada nhi hai gujranwalastan,1
 nawaz family is se kahi zayada paki awam ka pese urati hai he dont even hav guts to show his assets,1
 ye ab zayada hu gaye d,1
 i thought you were kuch zayada wala angrybut i dont mindcuz tujhse angry no way,1
 zayada khush mat ho mazakh tha ,1
menay tumhai dekhaatum pehlay say zayada payari ho gae o lt3,1
 lmao ye zayada ho gaya even may srkians wont tweets ego srkianssalmaniacstogether,1
 virgo se zayada he pvirgo selfish h0tay hain p ,1
 ahmad kya aap bhi excited ho apni bday k liye hum shahzadians tu bht zayada exited hain ,1
 hello krurika tu kuch zayada nai karrahi hai muje kisi ko certificate nai deyna,1
 aur aap ki besharami ki b koi hud nahi 100 din say zayada pti aur ik ko support kar rahay ho mulak dushmani ki inteha kardi,1
 bijli ka bill zayada ae tu dukh hota hai lekin neighbors ka bill apny sy zayada ae tu sun kr skoon milta hai ,1
good morning mere shero how is everybody its been long since i said hello sab ko bahut zayada pyar have a super day khush raho,1
 k baad hi ik nay react kiya tha agar yad ho tu iss op ka dukh sabsay zayada ik ko tha,1
 young death always hard to digestwo b iss trh ki jis main laparwahi ka dakhal zayada ho,1
 bageerah se zayada hairaan or pereshan insaan aj tuk maine nahi daikha,1
 mujhy ya bataoo yaha sub ya qus subsay zayada q kartay hy k kse hoo subhaa say jawab day kar tang agee hoo,1
ek pakora kiya zayada kha lo pait pregnant aurat jesa ho jata haikya bakwas hai,1
toot jayengay agar rishtay koi bat nahinasha doulat mey zayada hai mohhaabbat se kahi,1
 o esa kya wese zayada door nhi ap miss hina bole to apoun bhai log ki nagrii mein hi dubai ,1
 lambay qad wali larki zayada sex nahe kr skti jtna chotay qad wali larki sex krti hai dr veena malik ky free totkay,1
talash usko mat kro jo duniya mein sb se zayada khobsurat hoblke talash usko kro jo apki duniya khobsurat bna dy ,1
 jab se bacha tha larkana m hoa aik jalsa miss nahi kia itne zayada log nahi dekhe,1
 bageerah se zayada hairaan or pereshan insaan aj tuk maine nahi daikha d,1
 shehbazsharif ne rs120k fee zayada kr k rs40k ka laptop de diyaaur pmln chutiye aisi khush ho rhe ha jaise ss ne infinity,1
 dekho gauhar bb7 ki winner rocking ko shocking kar dala haha kisne kaha itna attitude dikhao,1
 nhi yr ajkal itna mja nhi aa rha bb dekhne ka,1
 ly bhai tu karachi ka ho kar itna dukhi ho raha tha new user hy shyed isi liay ,1
 hahhaha nahi p meray pass itna time nahi ke tmhari bisti krn p achasorry p,1
bas aj k liay itna kafi hqi ,1
 banda farigh ho per itna na ho ,1
 pita ji aap hamari itni care karte ho itni care karte hoitna care to koi maa apne bache ka bhi nahi karti pita ji thanks,1
 bhai khud ko itna negative mat lo p ,1
 mujhy aj tak smjh nhi aya sb mujh itna kaise jantay hain p,1
 hahahaha calm down calm down koi baat nai chalta hai itna dil pr kio le rahay hain p chill krain,1
lagta mujh ko sab sahiitna tou hai khud pe yaqeengujranwalastandswithik internationalprideik larkanaforpti ,1
 oh bhains itna tight match hard luck kal kay liye best of luck,1
itna gurur na kar aye bewafa apni jeet parteri jeet se jayda charche to meri haar ke hain,1
 wa wa wa to is mn itna sochny ki kia baat hai p,1
itna maza kyun aarha hai tu ne hawa mein bhang milaya,1
 itna confusing tweet duvidha mein daal dia ki cid se pradyuman bhi ake yeh solve nahi kar payega ,1
 hahahahaha ye bhi sahi hai bt itna time to hota hee hai yaar p,1
dard ita tha zdag me dharka sath dee se ghara gayad th akhe ks k yaad memout aa r dhoka kha gay,1
 wewantharshikaback to ktd mere baare mein itna math soch na dil mein aathi hoon varna laath maarthi hoon ,1
 itna serious mazaq bhi theek nahi na hahaha ,1
phr rat ho rhi hai phr yad arhy ho hoi kya khata jo itna sta rhe holagai hai ye q judai ki aag tmnykhud b jal rhe homuje b jala rhe ho,1
har dinhar raat tanhai m guzar jaty he gham ki chadar orh karskia humara gunah itna ara he k koi hamain yaad tak nahi karta,1
 tau aastaghfirullah itna jhoot,1
 phir shuru ho gaya bey tum there are two questionsaitna samay kaha se laatey hobitne paise kaha se laate ho,1
 main tax number tuje q du who r u tera leader itna imandaar hota to aaj log u thar main na marte koi help ki hoti unki,1
 hahaha wahi tu khair ha yaar itna down feel na karo life enjoy karo aisay depressing tweets karogay tu acha feel kaisay hoga,1
 khuwari itna asaan eh mene gcse k exams 1 month me prep kr k dye aur as n bs aye ayn mere,1
 cool yar phr itna parh likh kr tooter salabrety banny ka khayal kaisy aya apko xd,1
 dil aakhir itna rota hai kyon ki tu daaru piye bina hi sota hai,1
koi itna amir nahi hota ki wo apna past kharid sakeaurkoi itna garib nhi hota ki wo apna future na badal sake ,1
 us ne pucha itna pyar q krte ho mujh se meny kaha kabi kisi ne apni zindagi se b nafrat ki hai kia,1
itna chutiyapa kaha se lete ho ,1
 satta main aane k liye itna nahi girna chahiye sir jee,1
 keya majority beh gandu feku ko itna adds karne ke bawajud 69 vtrs ne reject kiya i mean thenga diya,1
 itna kamzor hua teri judai seitna kamzor hua teri judai seke ab to machar bhi khich le jate hai charpai ,1
 hey lets share this to all akkians haterjal toh rahe hai itna trend dekh ke aur jalao inko waiting for baby trailer http,1
 itna sb ho rha he srkar kyo aankh kan band kiye he pta nhi,1
 vasundhra ji supream court to dega fair judgement itna to trst h hme pr apne or apki hindu wadi bjp ne ,1
 chalo itna insist kar rahe ho to maan leta hu ,1
 ahaha burhan itna bura bhi nahi hai see the name says all naam hi kafi hy p,1
aagaya owaisi ka pilladishwasher rt tu bada bhouk raha hai award tou tuje dena chahiye p,1
 its already bada shanu p maula salamat rakhen mashallah,1
bijli ke dam kar diye kumyeh hain ak inmein hai bada dumab bjp ke dil mein hai gumdengein 5 sal kejriwal is baar hum mufflerman,1
 bada tough competition haijo jita wo sabse bada wala,1
 wah ab samaj aa raha hai last year to bada unfair unfair kar rhi thi,1
 tee this 1 rofljhingalala ye toh bada toing haiiii,1
zindagi udashone ka naam nahidost sirf paas hone ka naam nahiagar tum dur rehkar bhi hamein yad karois se bada hamare liye koi inaam nahi,1
 chalu nahi hai bhalayi ki supply lagta hai,1
 pakistani dunya ki azeem tareen bahadur qaum hai qaum ne deshat gardi ki laanat ka bahaduri se muqabla kia coas rah,1
muhabbat barsa dey na tu sawan aya hai,1
 am more then u but neend to neend hai apne time pe he ayegi u can sleep ,1
 yeh tu marny marny ki baat hai,1
 tumsayachakaunhai3main aur usko bhul jaun kaisi baatekarte hosurat to phir surat hai wah naam bhi pyara lagta he http,1
 nai bhaimera yaha koi dost nahi hai ,1
allah zaror ik sb victory diyega q sach always jeet malti hai mere yaqeen hai,1
 theek hai maaf kia dnt repeat sane mistake ok ,1
 achi bhi hai,1
best neend car mein aati hai,1
lrkyon se zyada garm silencer hota hai gari ka,1
 hainaa gauahar khan nai sai salman khan hi kar le xp,1
 ni imaandaar ho main,1
 nai btao nah apna address plzz p,1
 babu ne tameez nai sikhai ja messi se sekhke aa punter blocked stfu,1
 main tou sindh board ki burai b nai karsakti kyun abba hai board main xd,1
 hahahha bt stillunique shok haihr kisi ka ye shok nai hota,1
 nai tanna karish ki dosti itni kmjor ni jo gulati tudwa de,1
 pena nai shmjti p matbul drink kar k tun hoye rehty uf waly p,1
 lolzzzz sure dekhtay hain phir ya app nai ya main nai bec us nay to buch jana hay for sure,1
bv tussi mere naal pyar nai krdy punjabi ne 17 bachon ki taraf ishara kiya aur bola te ay fer main net to download keety c ,1
ab jb sonay ka time haito neend urh gai haikia ye khulla tazaad nai ,1
 nai bb bb sekh raha ho d,1
 hahahaha darme wali kahani tweeter par nai sona sakta hahahahaha bas yehi samjhin maje hi maje hahah,1
he fuck on credit nai men r wickedltlt human,1
 tum wesay ye kabee nai kersekti,1
 ya allah shair hi shair mujy kyun nai aataaa,1
 nai ham pathan hay ,1
tu jawan ay tera dosh nai mere tay ki beti tenu hosh nai,1
 yeh ha aik gharib mulk ka ayesh pm jis ko awam key nai apnay karobar ket faker ha ,1
 hmm achi hai bt finals k liye abhi start nai ki maine p,1
 agar hota kisi ke pass aisa dil to dil ki duniya jannt hoti badalte mausan me bi tapta viran registan nai,1
alite channel doing good reporting well done it has cross media ownership with daily nai baat,1
 acha nhi mje to sun nai mai kisi maths k paper se zyada asan nhi lagti lol tme kese easy lagti hai,1
 aese loug botany parh b nai sakte,1
 ok na karo bat maine b ab tum se bat nai krni phir roti rehna k boota bat nai krta ,1
 nai nai kisi aur ne to nai krni uski nature aise hai h nai na shukarrr,1
 imran khan say tu rata b nai lagay ga lol,1
 uski begum hai na nazar wattooonai lage gi usko nazar p,1
 ab bro bolny ki b khas lod nai thiwaisy keh do k u alreay havedil he tor diya ,1
 khairat he mang rha hai na mulk to nai loot rha jaisay tum logo nay lota hai,1
 hahaha mazdooro se kum nai lag rhaay hotay becharay p,1
 ab to mai chup nai hunga beta p,1
 tbhi to dekha mene ye khuwaab nai to kahan se dekhta,1
 good yaar work hard aagay yehi mehnat kaam aye gee ia nai kik wik nai krti use main,1
 rt karein agar aap ko lagta hai ki jack wilshere iss muqaable ka chutya hai,1
 mein sirf bhaijaan keliye ye trend kaarungabhaijaan ka agar kisike saath dushmani nahi to mera bhi nahi srkianssalman,1
 tum apne dil ko tasalli de lo agar milti hei gillani ke kehne seapni ankhein nahi hein apki,1
 agar ye dono nd aise hi pyaar se rahenge to pura bollywood unke isaro par nachega srkianssalmani,1
 dekho yar ladho matagar salman ko prblm nahi hai to hume q u following being human then think positive spread ,1
 haq ek behtar zindaagi kaheres a link to my latest tv commercialhttpstco2kuszlemdphope u guys will like it,1
 hazaar log hazaar batein sawaal ekjawab tum,1
 clarkston is returning to ford field the wolves beat ek 3513 in a a division 1 semifinal game,1
im guessing right now that my mom is expressing her dismay at eks puck possession skills justaguess,1
 allah swt ap ko her haal may zindagi k her pel may apni rehmat or fazal say nawazay life ka ek ek pel kushiyon say bhera ho,1
nightmare sequence from ek and boro there bad pass thorough the middle by karlsson then boro giveaway trying to go backhand off glass,1
 sirf or sirf aapke liye hi ho or kisi ke liye vo shabad ban ho pita ji ek or bat taweet ke liye shabado ki limit h,1
 ek wonder geen geurige parfuum ,1
 ek mukhtasar saa raaz hain jiyaakoi dost dagaa baaz hain ,1
 life ka one day match chal raha hai na jaisy p yar mai ek hi dafa clean bowled honay par believe rakhti hun iykwim d,1
how may times will ek turnover in this damn game grrrrrr,1
meri kal presentation hey jis ka me ne abi tk ek lafz b nhe perha ,1
good game to my cousin for kicking the crap out of ek today,1
ek hi road ko baar baar banate hai waiting for baby trailer,1
ajj pehli bar new karachi dekhawaqai ek alag hi karachi lagta haiiykwim ,1
 chakki fans ki islie jali padi h coz agr hum ek ho gae to smjh jao d srkianssalmaniacstogether ,1
 srk amp salman dancing wo v ek sathyoyo bigkhanreception ,1
 what a fud the people of ek voted for this bawbag,1
 ik ek bebak nidar honest clean leader hey aap khud jantey hen ,1
 awww nd me 2 blankets uper ek neechay,1
ek lost today,1
 we led with our conviction rather than rational because rational said it was impossible daniel ek spotify,1
 mubark ho sb ek sath ho gaye srkianssalmaniacstogether ,1
 abid sherali ko jawab dena aisy he jesy keechar me pathar marnaye helicopter me bethy ya gadhey pr ek he bat ha,1
 dekho mne dekha h ek sapna phoolon k ghr mn ho ghr apna,1
 youre welcome thanks for coming by and have a wonderful day ek,1
 kahan ghayab thin saara dinn p ,1
 saara you slut,1
 lefty sab ka jamaat hai ye saara economics school rob the rich and distribute among the poor wale robinhood bante hain sab,1
 i missed the match suna hai chutiapa hee saara hai phir se wenger bohot predictable hai ab,1
 yeh bhashan dene waala pm toh saara desh farokht kar dega,1
 waesey pakistan ka saara gand pti mn jama hochuka hai aap ki shammoliat is mn char chaand lga degigo ahead,1
kyoon tu achi lagti haiwaqt mila tu sochyngetujh mein kiya kiya dekha haiwaqt mila to sochyngesaara shehr ,1
 mile koi bhi tera zikr cheer dete hainke jese saara jahaan razdaar apna haiurdupoetryahmedfaraz,1
 bahut saara dhanyawaad siraapne yaad rakha mujhe grateful aaj shaam jaa rahein pehli isl dekhne,1
tere deedar ki aas mein atay hain teri galiyon mein rana warna saara shehar baaqi hai awaargi k liye,1
 saara kaam mei hi karloun acha um awesomest person on planet earth or queen or perfection,1
